year,month,day,author,text_it,month_string,text_pl,text_en,text_es,text_fr,text_zh,text_de,text_pt
2022,8,14,Holy Mary,"Cara figlia, grazie per avere risposto alla mia chiamata nel tuo cuore. Figlia mia, domani è la festa della Mia Assunzione in cielo, Giovanni in quel momento mi era accanto, aveva adornato il mio lettino di fiori freschi e profumati. Dopo essermi addormentata, una luce folgorante ha invaso la stanzetta, ma una luce ancora più forte si è sovrapposta, rendendo la cameretta piena di lucine che brillavano di tanti colori ed ecco gli angeli che mi hanno sollevata e portata all’incontro con mio Figlio Gesù. Figlia mia, tocco ancora la terra per aiutare l’umanità a convertirsi e amare Dio, così come l’ho amato Io, siate simili a me e portate nel cuore le sofferenze di questi periodi che state vivendo e di quelli che vivrete, sappiate che Io vi sarò sempre accanto per consolarvi. Non potete neanche immaginare quanta gioia abbia provato, all’incontro con mio Figlio ed è così che vorrei fosse il vostro incontro quando presto Lui arriverà. Ora vi benedico nel nome del Padre, del Figlio e dello Spirito Santo, amen.",August,"Droga córko, dziękuję ci, że odpowiedziałaś na Moje wezwanie w twoim sercu. Córko, jutro jest święto Mojego Wniebowzięcia do Nieba, Jan był w tym momencie obok mnie, ozdobił moje małe łóżko świeżymi, pachnącymi kwiatami. Po tym, jak zasnęłam, do małego pokoju wtargnęło oślepiające światło, ale nałożyło się na nie jeszcze silniejsze światło, sprawiając, że mały pokój był pełen małych światełek, które świeciły wieloma kolorami, a aniołowie podnieśli mnie i poprowadzili na spotkanie z moim Synem Jezusem. Moja córko, wciąż przychodzę na ziemię, aby pomóc ludzkości nawrócić się i pokochać Boga tak, jak ja Go pokochałam, bądź podobna do mnie i noś w sercu cierpienia tych czasów, które przeżywasz i tych, które przeżyjesz, wiedz, że zawsze będę obok ciebie, aby cię pocieszyć. Nawet nie wyobrażacie sobie, jak wielką radość czułam, gdy spotkałam mojego Syna i tak chciałabym, aby wasze spotkanie było takie, gdy On przyjdzie wkrótce. Teraz błogosławię was w imię Ojca i Syna i Ducha Świętego, Amen.","Dear daughter, thank you for answering My call in your heart. My daughter, tomorrow is the feast of My Assumption into Heaven, John was beside me at that moment, he had adorned my little bed with fresh, fragrant flowers. After I fell asleep, a dazzling light invaded the little room, but an even stronger light superimposed itself, making the little room full of little lights that shone with many colors, and here were the angels who lifted me up and brought me to the meeting with My Son Jesus. My daughter, I am still touching the earth to help mankind to convert and love God as I have loved Him, be like Me and carry in your heart the sufferings of these times you are experiencing and those you will experience, know that I will always be beside you to console you. You cannot even imagine how much joy I felt, at the meeting with my Son and that is how I would like your meeting to be when He comes soon. Now I bless you in the name of the Father and the Son and the Holy Spirit, Amen.","Querida hija, gracias por responder mi llamada en tu corazón. Mi hija, mañana es la fiesta de mi suposición en el cielo, John en ese momento estaba a mi lado, había adornado mi cama de flores frescas y fragantes. Después de quedarse dormido, una luz deslumbrante invadió la habitación, pero una luz aún más fuerte se superpone, haciendo que el dormitorio lleno de luces que brillaban con muchos colores y aquí están los ángeles que me criaron y llevaron al encuentro con mi hijo Jesús. Mi hija, mi hija, Todavía toco la tierra para ayudar a la humanidad a convertir y amar a Dios, así como lo amaba, ser similar a mí y traído a mi corazón los sufrimientos de estos períodos que vives y aquellos que vives, saben que siempre estaré a tu lado para consolarte. Ni siquiera puedes imaginar cuánta alegría probó, en la reunión con mi hijo y así es como desearía que fuera tu reunión cuando vendrá pronto. Ahora te bendigo en el nombre del Padre, el Hijo y el Espíritu Santo, Amén.","Chère fille, merci d'avoir répondu à mon appel dans votre cœur. Ma fille, demain est la fête de mon hypothèse dans le ciel, John était à côté de moi à ce moment, il avait orné mon petit lit avec des fleurs fraîches et parfumées. Après que je me suis endormi, une lumière éblouissante a envahi la petite pièce, mais une lumière encore plus forte se superposait, rendant la petite pièce pleine de petites lumières qui brillaient de nombreuses couleurs, et voici les anges qui m'ont soulevé et m'ont amené à la réunion avec mon fils Jésus. Ma fille, je touche toujours la terre pour aider l'humanité Soyez à côté de vous pour vous consoler. Vous ne pouvez même pas imaginer à quel point je ressentais de la joie, lors de la rencontre avec mon fils et c'est ainsi que j'aimerais que votre rencontre soit quand il viendra bientôt. Maintenant, je vous bénis au nom du Père et du Fils et du Saint-Esprit, Amen.",亲爱的女儿，谢谢您在心中接我的电话。我的女儿，明天是我对天堂的假设的盛宴，约翰当时在我旁边，他用新鲜的芬芳的花朵装饰了我的小床。我入睡后，一个耀眼的灯侵入了这个小房间，但是一个甚至更强壮的灯叠加了，使小房间里充满了小灯光，照亮了许多颜色，这里的天使将我抬起，把我带到了会议上和我的儿子耶稣。我的女儿，我仍在触摸地球，以帮助人类像我爱他一样convert依和爱上帝，像我一样，在您的心中忍受您所经历的时代的痛苦，您会经历的那些人，知道我将永远在你旁边安慰你。您甚至无法想象在与儿子的会议上会议上我的喜悦，这就是我希望您很快就会开会的方式。现在，我以父，儿子和圣灵的名义祝福你。,"Liebe Tochter, danke, dass du meinen Anruf in deinem Herzen beantwortet hast. Meine Tochter, morgen ist das Fest meiner Annahme in den Himmel, John war in diesem Moment neben mir, er hatte mein kleines Bett mit frischen, duftenden Blumen geschmückt. Nachdem ich eingeschlafen war, drang ein schillerndes Licht in den kleinen Raum ein, aber ein noch stärkeres Licht überlagte sich selbst und ließ den kleinen Raum voller kleiner Lichter, die mit vielen Farben leuchteten mit meinem Sohn Jesus. Meine Tochter, ich berühre immer noch die Erde, um der Menschheit zu helfen, Gott zu konvertieren und zu lieben, wie ich ihn geliebt habe, wie ich zu sein und in deinem Herzen die Leiden dieser Zeiten, die du erlebst, und die, die du erleben wirst, weiß, dass ich immer werde Sei neben dir, um dich zu trösten. Sie können sich nicht einmal vorstellen, wie viel Freude ich fühlte, bei dem Treffen mit meinem Sohn und so möchte ich, dass Ihr Treffen sein, wenn er bald kommt. Jetzt segne ich dich im Namen des Vaters und des Sohnes und des Heiligen Geistes, Amen.","Querida filha, obrigado por atender minha chamada em seu coração. Minha filha, amanhã é o banquete da minha suposição no céu, João estava ao meu lado naquele momento, ele adornava minha cama pequena com flores frescas e perfumadas. Depois que adormeci, uma luz deslumbrante invadiu a pequena sala, mas uma luz ainda mais forte se sobreposta, fazendo a pequena sala cheia de pequenas luzes que brilhavam com muitas cores, e aqui estavam os anjos que me levantaram e me trouxeram para a reunião com meu filho Jesus. Minha filha, ainda estou tocando a terra para ajudar Esteja ao seu lado para consolar você. Você não pode nem imaginar quanta alegria me senti, na reunião com meu filho e é assim que eu gostaria que sua reunião fosse quando ele vier em breve. Agora eu te abençoo em nome do Pai, do Filho e do Espírito Santo, Amém."
2022,8,20,Holy Mary,"Cari figli Benedetti, grazie per aver piegato le vostre ginocchia nella preghiera e per aver ascoltato la mia chiamata nel vostro cuore. Mio Figlio vi ha chiesto di abbeverarvi ai piedi della croce, ma molti non cercano acque dolci e benedette, ma acque salmastre. Nessuno o pochi vedono tutto ciò che accade sulla terra, il cielo vi invia i segnali per pregare di più, ma molti continuano nella loro cecità. Figli miei, il deserto avanza e sarete invasi da altri fratelli. Figli, pregate per i sacerdoti perché non sono tutti pastori, non portano le pecore all’ovile. Figli, udite e guardate, non siate distratti e vi prego convertitevi, è molto urgente. Ora vi benedico nel nome del Padre, del Figlio e dello Spirito Santo, amen.",August,"Drogie błogosławione dzieci, dziękuję wam, że uklęknęliście do modlitwy i że posłuchaliście mojego wezwania w waszych sercach. Mój Syn prosił was o picie u stóp Krzyża, ale wielu nie szuka świeżych i błogosławionych wód, ale wód słonych. Niewielu jest w stanie zobaczyć wszystko, co się dzieje na ziemi. Niebo zsyła wam znaki, abyście się mocniej modlili, ale wielu trwa w swojej ślepocie. Moje dzieci, pustynia przybliża się i zostaniecie najechani przez innych braci. Moje dzieci, módlcie się za kapłanów, bo nie wszyscy są pasterzami, nie wszyscy wprowadzają owce do owczarni. Moje dzieci, słuchajcie i patrzcie, nie rozpraszajcie się i proszę o nawrócenie, to bardzo pilne. Teraz błogosławię was w imię Ojca i Syna i Ducha Świętego, Amen.","Dear blessed children, thank you for bending your knees in prayer and listening to my call in your heart. My Son has asked you to drink at the foot of the Cross, but many do not seek fresh and blessed waters, but brackish waters. No one or few see all that is happening on earth; heaven sends you signs to pray more, but many continue in their blindness. My children, the desert is advancing and you will be invaded by more brothers. My children, pray for the priests because they are not all shepherds, they do not bring the sheep to the fold. My children, hear and watch, do not be distracted and please convert, it is very urgent. Now I bless you in the name of the Father and the Son and the Holy Spirit, Amen.","Estimados niños de Benedetti, gracias por doblar las rodillas en oración y por haber escuchado mi llamada en su corazón. Mi hijo te pidió que te abandonara al pie de la cruz, pero muchos no buscan aguas frescas y bendecidas, sino aguas salobres. Ninguno o pocos ven todo lo que sucede en la tierra, el cielo te envía las señales para rezar más, pero muchos continúan en su ceguera. Mis hijos, el desierto avanza y serán invadidos por otros hermanos. Niños, rezan por los sacerdotes porque no todos son pastores, no traen ovejas al redil. Los niños, escuchan y miran, no se distraen y se conviertan, es muy urgente. Ahora te bendigo en el nombre del Padre, el Hijo y el Espíritu Santo, Amén.","Chers enfants bénis, merci d'avoir plié vos genoux dans la prière et d'écouter mon appel dans votre cœur. Mon fils vous a demandé de boire au pied de la croix, mais beaucoup ne cherchent pas des eaux fraîches et bénies, mais des eaux saumâtres. Personne ou peu ne voient tout ce qui se passe sur Terre; Le ciel vous envoie des signes pour prier plus, mais beaucoup continuent dans leur cécité. Mes enfants, le désert avance et vous serez envahi par plus de frères. Mes enfants, prient pour les prêtres parce qu'ils ne sont pas tous des bergers, ils n'apportent pas les moutons au giron. Mes enfants, entendent et regardent, ne sont pas distraits et veuillez convertir, c'est très urgent. Maintenant, je vous bénis au nom du Père et du Fils et du Saint-Esprit, Amen.",亲爱的祝福的孩子们，感谢您屈服于祈祷，并听我​​的电话。我的儿子要求您在十字架的脚下喝酒，但许多人不寻求新鲜而有福的水，而是咸水。没有人看到地球上发生的一切。天堂向您发送迹象，以祈祷更多，但许多人仍在失明。我的孩子们，沙漠正在前进，您将被更多兄弟入侵。我的孩子们，为祭司祈祷，因为他们不是所有牧羊人，他们不会把绵羊折叠起来。我的孩子，听和观看，不要分心，请转换，这是非常紧急的。现在，我以父，儿子和圣灵的名义祝福你。,"Liebe gesegnete Kinder, vielen Dank, dass Sie sich die Knie im Gebet gebeugt und meinen Anruf in Ihrem Herzen zugehört haben. Mein Sohn hat Sie gebeten, am Fuße des Kreuzes zu trinken, aber viele suchen keine frischen und gesegneten Gewässer, sondern brackiges Wasser. Niemand oder nur wenige sehen alles, was auf Erden geschieht; Der Himmel schickt dir Zeichen, um mehr zu beten, aber viele weiterhin blind. Meine Kinder, die Wüste rechnet vor und Sie werden von mehr Brüdern eingedrungen. Meine Kinder beten für die Priester, weil sie nicht alle Hirten sind, sie bringen die Schafe nicht in die Falte. Meine Kinder hören und beobachten, nicht abgelenkt und bitte konvertieren, es ist sehr dringend. Jetzt segne ich dich im Namen des Vaters und des Sohnes und des Heiligen Geistes, Amen.","Caros filhos abençoados, obrigado por dobrar os joelhos em oração e ouvir minha chamada em seu coração. Meu filho pediu que você bebesse no pé da cruz, mas muitos não procuram águas frescas e abençoadas, mas águas salobras. Ninguém vê tudo o que está acontecendo na terra; O céu envia sinais para orar mais, mas muitos continuam em sua cegueira. Meus filhos, o deserto está avançando e você será invadido por mais irmãos. Meus filhos, oram pelos sacerdotes porque nem todos são pastores, eles não trazem as ovelhas para o dobro. Meus filhos, ouvem e assista, não se distraem e convertem, é muito urgente. Agora eu te abençoo em nome do Pai, do Filho e do Espírito Santo, Amém."
2022,8,23,Holy Mary,"Cari figli, grazie per aver risposto alla mia chiamata nel vostro cuore. Figli miei, pregate, pregate tanto, perché il mondo è in grande pericolo, l’umanità è in grande pericolo, anche la Chiesa chiude le porte.  Figli miei, presto uno scisma farà tremare la Chiesa di Roma, avvolta dalle tenebre. Figli miei, ricordate che Io sono qui tutti i giorni insieme al mio Gesù, non temete perché avrete sempre il nostro conforto, quando invocherete i nostri nomi.  Figli, pregate in particolare per la Francia, perché ha perso la fede, i segnali inviati dal cielo saranno molto forti ed evidenti. Ora vi benedico nel nome del Padre, del Figlio e dello Spirito Santo, amen.",August,"Drogie dzieci, dziękuję wam, że w waszych sercach odpowiedzieliście na moje wezwanie. Moje dzieci, módlcie się, módlcie się mocno, bo świat jest w wielkim niebezpieczeństwie, ludzkość jest w wielkim niebezpieczeństwie, nawet Kościół zamyka swoje drzwi. Moje dzieci, wkrótce schizma wstrząśnie Kościołem Rzymskim, owianym ciemnością. Moje dzieci, pamiętajcie, że jestem tu codziennie z moim Jezusem, nie lękajcie się, bo zawsze was pocieszymy, gdy będziecie przywoływać nasze imiona. Moje dzieci, módlcie się szczególnie za Francję, ponieważ straciła wiarę, znaki wysyłane z nieba będą bardzo silne i widoczne. Teraz błogosławię was w imię Ojca i Syna i Ducha Świętego, Amen.","Dear children, thank you for responding to my call in your hearts. My children, pray, pray much, for the world is in great danger, humanity is in great danger, even the Church is closing its doors.  My children, soon a schism will shake the Church of Rome, shrouded in darkness. My children, remember that I am here every day together with my Jesus, do not fear because you will always have our comfort when you invoke our names. My children, pray especially for France, for she has lost her faith, the signs sent from heaven will be very strong and evident. Now I bless you in the name of the Father and the Son and the Holy Spirit, Amen.","Queridos hijos, gracias por responder mi llamada en tu corazón. Mis hijos, rezan, rezan mucho, porque el mundo está en gran peligro, la humanidad está en gran peligro, la iglesia también cierra las puertas. Mis hijos, pronto un cisma hará temblar la Iglesia de Roma, rodeada de la oscuridad. Mis hijos, recuerdan que estoy aquí todos los días junto con mi Jesús, no tengan miedo porque siempre tendrás nuestra comodidad cuando invocas nuestros nombres. Los niños, rezaron en particular por Francia, porque ha perdido la fe, las señales enviadas desde el cielo serán muy fuertes y evidentes. Ahora te bendigo en el nombre del Padre, el Hijo y el Espíritu Santo, Amén.","Chers enfants, merci dans vos cœurs, vous avez répondu à mon appel. Mes enfants, priez, priez dur, parce que le monde est en grand danger, l'humanité est en grand danger, même l'église ferme sa porte. Mes enfants, bientôt le schisme, secouera l'église romaine, enveloppée d'obscurité. Mes enfants, rappelez-vous que je suis ici avec mon Jésus tous les jours, n'ayez pas peur car nous vous réconforterons toujours lorsque vous appellerez nos noms. Mes enfants, prient surtout pour la France, car elle a perdu la foi, les panneaux envoyés du ciel seront très forts et visibles. Maintenant, je vous bénis au nom du Père et du Fils et du Saint-Esprit, Amen.",亲爱的孩子们，谢谢您，您在心中回应了我的电话。我的孩子们，祈祷，努力祈祷，因为世界处于极大的危险之中，人类处于极大的危险之中，甚至教会都关门。我的孩子们很快分裂将摇晃罗马教堂，笼罩在黑暗中。我的孩子们，请记住我每天都和我的耶稣在这里，不要害怕，因为当您叫我们的名字时，我们将永远安慰您。我的孩子们特别为法国祈祷，因为她失去了信心，所以从天上寄出的迹象将非常强烈和可见。现在，我以父亲和儿子和圣灵的名义祝福您。,"Liebe Kinder, danke, dass Sie in Ihren Herzen auf meinen Anruf geantwortet haben. Meine Kinder beten, beten hart, denn die Welt ist in großer Gefahr, die Menschheit ist in großer Gefahr, sogar die Kirche schließt ihre Tür. Meine Kinder, bald wird Schisma die römische Kirche schütteln, in der Dunkelheit gehüllt. Meine Kinder, denken Sie daran, dass ich jeden Tag mit meinem Jesus hier bin, haben Sie keine Angst, weil wir Sie immer trösten, wenn Sie unsere Namen nennen. Meine Kinder beten besonders für Frankreich, weil sie den Glauben verloren hat, die Zeichen, die vom Himmel geschickt wurden, werden sehr stark und sichtbar sein. Jetzt segne ich dich im Namen des Vaters und des Sohnes und des Heiligen Geistes, Amen.","Caros filhos, obrigado em que em seus corações você respondeu à minha ligação. Meus filhos, orem, orem com força, porque o mundo está em grande perigo, a humanidade está em grande perigo, até a igreja fecha sua porta. Meus filhos, logo o cisma abalará a igreja romana, envolta na escuridão. Meus filhos, lembre -se de que estou aqui com meu Jesus todos os dias, não tenha medo, porque sempre o confortaremos quando você chamar nossos nomes. Meus filhos, oram especialmente pela França, porque ela perdeu a fé, os sinais enviados do céu serão muito fortes e visíveis. Agora eu te abençoo em nome do Pai e do Filho e do Espírito Santo, Amém."
2022,8,27,Holy Mary,"Cari figli, grazie per aver ascoltato la mia chiamata nel vostro cuore e per aver piegato le ginocchia nella preghiera. Figlia mia, conduci il mio popolo verso Dio, non aver paura, anche Io portai un grande peso nel mio cuore, ma avrai la grazia per poter essere più forte. Pregate figli, per le centrali nucleari dell’est, perché inizia il pericolo per i miei figli. Pregate per la Chiesa e siate uniti nel nome di Gesù Cristo. Figli miei tocco la terra e cammino nel mio pellegrinaggio terreno per togliere i miei figli dal fango, eppure ancora vedo che rifiutano la grazia. Figlia mia, non temere, Io sarò sempre al tuo fianco e vi benedico tutti nel nome del Padre, del Figlio e dello Spirito Santo, amen.",August,"Drogie dzieci, dziękuję wam, że słuchacie mojego wołania w waszym sercu i że uklęknęliście do modlitwy. Moje dziecko, prowadź mój lud ku Bogu, nie bój się, ja też noszę w sercu wielki ciężar, ale ty będziesz miała łaskę, że będziesz silniejsza. Módlcie się, moje dzieci, za elektrownie atomowe na wschodzie, bo zaczyna się niebezpieczeństwo dla moich dzieci. Módlcie się za Kościół i bądźcie zjednoczeni w imię Jezusa Chrystusa. Moje dzieci, dotykam ziemi i chodzę w mojej ziemskiej pielgrzymce, aby usunąć moje dzieci z bagna, a jednak wciąż widzę, że odrzucają łaskę. Moje dziecko, nie lękaj się, ja zawsze będę przy tobie i błogosławię was wszystkich w imię Ojca i Syna i Ducha Świętego, Amen.","Dear children, thank you for hearing My call in your heart and for bending your knees in prayer. My child, lead My people to God, do not be afraid, I also carried a great burden in My heart, but you will have the grace to be able to be stronger. Pray children, for the nuclear power plants in the East, for danger begins for My children. Pray for the Church and be united in the name of Jesus Christ. My children I touch the earth and walk in my earthly pilgrimage to remove my children from the mud, yet still I see that they reject grace. My child, do not fear, I will always be at your side and bless you all in the name of the Father and the Son and the Holy Spirit, Amen.","Queridos hijos, gracias por escuchar mi llamada en su corazón y por haber doblado las rodillas en oración. Mi hija, llevo a mi pueblo hacia Dios, sin tener miedo, también traje un gran peso en mi corazón, pero tendrás gracia para ser más fuerte. Ore por los niños, por las centrales nucleares del este, porque el peligro comienza para mis hijos. Ore por la Iglesia y unirse en el nombre de Jesucristo. Mis hijos tocan la tierra y caminan en mi peregrinación terrenal para sacar a mis hijos del barro, pero aún así veo que rechazan la gracia. Mi hija, no temas, siempre estaré a tu lado y los bendeciré a todos en el nombre del Padre, el Hijo y el Espíritu Santo, Amén.","Chers enfants, merci d'avoir entendu mon appel dans votre cœur et d'avoir plié vos genoux dans la prière. Mon enfant, dirige mon peuple à Dieu, n'ayez pas peur, j'ai également porté un grand fardeau dans mon cœur, mais vous aurez la grâce de pouvoir être plus fort. Priez les enfants, pour les centrales nucléaires à l'est, car le danger commence pour mes enfants. Priez pour l'Église et soyez unis au nom de Jésus-Christ. Mes enfants, je touche la terre et marche dans mon pèlerinage terrestre pour retirer mes enfants de la boue, mais je vois toujours qu'ils rejettent la grâce. Mon enfant, ne craigne pas, je serai toujours à vos côtés et vous bénirai tous au nom du Père et du Fils et du Saint-Esprit, Amen.",亲爱的孩子们，感谢您听到我心中的电话，并在祈祷中弯腰。我的孩子，带领我的子民前往上帝，不要害怕，我的内心也承担着巨大的负担，但是您将有能力变得更坚强的恩典。祈祷儿童，因为东方的核电站为我的孩子们开始危险。为教会祈祷，以耶稣基督的名义团结起来。我的孩子们，我触摸地球，走进我的尘世朝圣，将我的孩子从泥泞中移走，但我仍然看到他们拒绝了恩典。我的孩子，不要害怕，我将永远站在你身边，以父亲，儿子和圣灵的名义祝福你们。,"Liebe Kinder, danke, dass du meinen Anruf in deinem Herzen gehört hast und deine Knie im Gebet beugt hast. Mein Kind, führe mein Volk zu Gott, habe keine Angst, ich habe auch eine große Last in meinem Herzen, aber du wirst die Gnade haben, um stärker zu sein. Beten Sie Kinder, für die Kernkraftwerke im Osten, denn für meine Kinder beginnt die Gefahr. Bete für die Kirche und sei im Namen Jesu Christi vereint. Meine Kinder berühren die Erde und gehe in meiner irdischen Pilgerreise, um meine Kinder aus dem Schlamm zu entfernen, aber ich sehe trotzdem, dass sie Gnade ablehnen. Mein Kind, fürchte nicht, ich werde immer an deiner Seite sein und dich alle im Namen des Vaters und des Sohnes und des Heiligen Geistes, Amen, segnen.","Caros filhos, obrigado por ouvir meu chamado em seu coração e por dobrar os joelhos em oração. Meu filho, leva meu povo a Deus, não tenha medo, também carregava um grande fardo em meu coração, mas você terá a graça de poder ser mais forte. Ore as crianças, para as usinas nucleares no Oriente, pois o perigo começa para meus filhos. Ore pela igreja e esteja unido em nome de Jesus Cristo. Meus filhos eu toco a terra e ando em minha peregrinação terrena para remover meus filhos da lama, mas ainda vejo que eles rejeitam a graça. Meu filho, não tema, eu sempre estarei ao seu lado e abençoei todos vocês em nome do Pai, do Filho e do Espírito Santo, Amém."
