year,month,day,author,text_it,month_string,text_pl,text_en,text_es,text_fr,text_zh,text_de,text_pt
2022,8,3,Holy Mary,"Cari figli benedetti, grazie per essere qui e per aver risposto alla mia chiamata nel vostro cuore. Figli, gioite perché la venuta di Gesù è vicina, aprite i vostri cuori, Io sono qui a toccare la terra per portare l’amore nelle vostre vite e prepararvi al giorno più bello, vedere il mio Gesù arrivare su una nube dal cielo. Credete in Cristo Gesù, unico profondo amore e Redentore. Figli amati, siate pronti ed Io vi metterò in prima fila per godere la meraviglia. Figli miei, amate e lodate Gesù, vostro Salvatore che verrà a donarvi la terra purificata dal male e per darvi una terra dove tutto sarà nuovo. Ora vi benedico nel nome della Santissima Trinità, amen. Oggi tante le grazie scenderanno su di voi, testimoniate!!",August,"Drogie błogosławione dzieci, dziękuję wam, że jesteście tutaj i że odpowiadacie na moje wezwanie w waszych sercach. Moje dzieci, radujcie się, bo przyjście Jezusa jest bliskie, otwórzcie swoje serca, jestem tutaj, aby poruszyć ziemię, aby wnieść miłość do waszego życia i przygotować was na najpiękniejszy dzień, aby zobaczyć mojego Jezusa przybywającego na obłoku z nieba. Uwierz w Jezusa Chrystusa, jedyną głęboką Miłość i Odkupiciela. Umiłowane dzieci, bądźcie gotowi, a Ja postawię was w pierwszym rzędzie, abyście mogli cieszyć się tym cudem. Moje dzieci, kochajcie i chwalcie Jezusa, waszego Zbawiciela, który przyjdzie, aby dać wam ziemię oczyszczoną ze zła i dać wam ziemię, w której wszystko będzie nowe. Teraz błogosławię was w imię Trójcy Przenajświętszej, Amen. Dziś wiele łask zstąpi na was, bądźcie ich świadkami!","Dear blessed children, thank you for being here and answering My call in your hearts. Children, rejoice because the coming of Jesus is near, open your hearts, I am here to touch the earth to bring love into your lives and prepare you for the most beautiful day, to see my Jesus coming on a cloud from heaven. Believe in Christ Jesus, the only deep Love and Redeemer. Beloved children, be ready and I will put you in the front row to enjoy the wonder. My children, love and praise Jesus, your Savior who will come to give you the earth cleansed of evil and to give you a land where everything will be new. Now I bless you in the name of the Most Holy Trinity, Amen. Today many graces will descend upon you, witness!","Cari figli benedetti, grazie per essere qui e per aver risposto alla mia chiamata nel vostro cuore. Figli, gioite perché la venuta di Gesù è vicina, aprite i vostri cuori, Io sono qui a toccare la terra per portare l’amore nelle vostre vite e prepararvi al giorno più bello, vedere il mio Gesù arrivare su una nube dal cielo. Credete in Cristo Gesù, unico profondo amore e Redentore. Figli amati, siate pronti ed Io vi metterò in prima fila per godere la meraviglia. Figli miei, amate e lodate Gesù, vostro Salvatore che verrà a donarvi la terra purificata dal male e per darvi una terra dove tutto sarà nuovo. Ora vi benedico nel nome della Santissima Trinità, amen. Oggi tante le grazie scenderanno su di voi, testimoniate!!","Chers enfants bénis, merci d'être ici et de répondre à mon appel dans votre cœur. Enfants, réjouissez-vous parce que la venue de Jésus est proche, ouvre vos cœurs, je suis ici pour toucher la terre pour apporter l'amour dans votre vie et vous préparer à la plus belle journée, voir mon Jésus venir sur un nuage du ciel. Croyez en Jésus-Christ, le seul amour profond et rédempteur. Enfants bien-aimés, soyez prêt et je vous mettrai au premier rang pour profiter de l'émerveillement. Mes enfants, aiment et louent Jésus, votre Sauveur qui viendra vous donner la terre nettoyée du mal et vous donner une terre où tout sera nouveau. Maintenant, je vous bénis au nom de la Très Sainte Trinité, Amen. Aujourd'hui, de nombreuses grâces vous descendent, témoigne!",亲爱的祝福的孩子们，谢谢您在这里并在您的心中接我的电话。孩子们很高兴，因为耶稣的来临即将到来，敞开心hearts，我在这里触摸地球，将爱带入您的生活，并为您做好最美丽的一天，看到我的耶稣从天上笼罩着乌云。相信基督耶稣，唯一的深爱和救赎者。心爱的孩子，准备好，我会把你放在前排享受奇迹。我的孩子们，爱和赞美耶稣，您的救主，他们会来给您邪恶的地球，并给您一片新的土地。现在，我以最圣洁的三位一体的名义祝福你。今天，许多恩典会降临在你身上，见证！,"Liebe gesegnete Kinder, danke, dass du hier bist und meinen Anruf in deinen Herzen beantwortet hast. Kinder, freut sich, denn das Kommen Jesu ist nahe, öffne deine Herzen, ich bin hier, um die Erde zu berühren, um Liebe in dein Leben zu bringen und dich auf den schönsten Tag vorzubereiten, um zu sehen, wie mein Jesus auf eine Wolke aus dem Himmel kommt. Glaube an Christus Jesus, die einzige tiefe Liebe und Erlöser. Geliebte Kinder, seien Sie bereit und ich werde Sie in die erste Reihe bringen, um das Wunder zu genießen. Meine Kinder, lieben und loben Jesus, dein Erretter, der kommen wird, um dir die Erde zu geben, die vom Bösen gereinigt wird, und dir ein Land zu geben, in dem alles neu sein wird. Jetzt segne ich dich im Namen der heiligsten Dreifaltigkeit, Amen. Heute werden viele Gnaden auf Sie herabsteigen, Zeugen!","Caros filhos abençoados, obrigado por estar aqui e atender minha chamada em seus corações. Os filhos, alegrem -se porque a vinda de Jesus está próxima, abre seus corações, estou aqui para tocar a terra para trazer amor em suas vidas e prepará -lo para o dia mais bonito, para ver meu Jesus vindo em uma nuvem do céu. Acredite em Cristo Jesus, o único amor profundo e redentor. Crianças amadas, estejam prontas e eu o colocarei na primeira fila para aproveitar a maravilha. Meus filhos, amor e louvar a Jesus, seu Salvador, que virá para lhe dar a terra limpa do mal e para lhe dar uma terra onde tudo será novo. Agora eu te abençoo em nome da Santíssima Trindade, Amém. Hoje, muitas graças descerem sobre você, testemunham!"
2022,8,9,Holy Mary,"Figli miei, grazie per aver risposto alla mia chiamata nel vostro cuore. Figli, l’umanità è in bilico, vi prego figli, tornate a Dio e alle sue leggi, Lui è misericordioso e se chiederete il perdono, ve lo concederà. Figli miei, le guerre inizieranno, finiranno, ma poi continueranno, pregate, perché non avete più tempo, che il vostro parlare sia, si si, no no. Continuo a venire a voi per istruirvi e spesso vi girate dall’altra parte. Figli miei, credete alle mie parole affinché siate preparati, il vostro cammino sarà piuttosto arduo e impervio, ma chi avrà come àncora il Santo Rosario, sarà salvato. Figli, seguite i dieci comandamenti, guardate mio Figlio e lì vedrete la luce. Figli, ci sarà un forte terremoto, nubifragi in continuazione, ma Io vi chiedo di pregare sotto la croce di mio Figlio e sarete Benedetti voi e le vostre famiglie. Ora vi benedico nel nome del Padre, del Figlio e dello Spirito Santo. amen.",August,"Moje dzieci, dziękuję wam, że odpowiadacie na moje wezwanie w waszych sercach. Moje dzieci, ludzkość jest w zawieszeniu, błagam was dzieci, powróćcie do Boga i Jego praw, On jest miłosierny i jeśli poprosicie o przebaczenie, On go udzieli. Moje dzieci, wojny będą się zaczynać, będą się kończyć, ale potem będą trwać, módlcie się, bo nie macie już czasu, niech wasza mowa będzie: tak tak, nie nie. Ciągle przychodzę do was, aby was pouczyć, a wy często się odwracacie. Moje dzieci, wierzcie moim słowom, abyście byli przygotowani, wasza droga będzie raczej uciążliwa i nieprzejezdna, ale kto ma Różaniec Święty jako kotwicę, ten będzie uratowany. Moje dzieci, przestrzegajcie Dziesięciu Przykazań, patrzcie w stronę mojego Syna, a tam zobaczycie światło. Dzieci, cały czas będą silne trzęsienia ziemi, oberwania chmur, ale proszę was o modlitwę pod Krzyżem mojego Syna, a wy i wasze rodziny będą błogosławione. Teraz błogosławię was w imię Ojca i Syna i Ducha Świętego, Amen.","My children, thank you for responding to my call in your hearts. My children, humanity is in the brink, please children, return to God and His laws, He is merciful and if you ask for forgiveness, He will grant it. My children, wars will begin, they will end, but then they will continue, pray, for you are running out of time, let your speech be, yes yes, no no. I keep coming to you to instruct you and you often turn away. My children, believe my words so that you may be prepared, your path will be rather arduous and impassable, but whoever has the Holy Rosary as an anchor will be saved. Children, follow the Ten Commandments, look to my Son and there you will see the light. Children, there will be a strong earthquake, cloudbursts all the time, but I ask you to pray under the cross of my Son and you and your families will be Blessed. Now I bless you in the name of the Father and the Son and the Holy Spirit, Amen.","Hijos míos, gracias por responder a mi llamada en vuestros corazones. Hijos míos, la humanidad está al borde, por favor hijos, volved a Dios y a sus leyes, Él es misericordioso y si pedís perdón, os lo concederá. Hijos míos, las guerras comenzarán, terminarán, pero luego continuarán, rezad, porque se os acaba el tiempo, que vuestro discurso sea, sí sí, no no. Sigo viniendo a vosotros para instruiros y a menudo os apartáis. Hijos míos, creed en mis palabras para que estéis preparados, vuestro camino será bastante arduo e intransitable, pero quien tenga el Santo Rosario como ancla se salvará. Hijos, seguid los Diez Mandamientos, mirad a mi Hijo y allí veréis la luz. Hijos, habrá un fuerte terremoto, chaparrones todo el tiempo, pero os pido que recéis bajo la cruz de mi Hijo y seréis bendecidos vosotros y vuestras familias. Ahora os bendigo en el nombre del Padre y del Hijo y del Espíritu Santo, Amén.","Mes enfants, merci d'avoir répondu à mon appel dans votre cœur. Mes enfants, l'humanité est au bord du bord, s'il vous plaît les enfants, retournent à Dieu et à ses lois, il est miséricordieux et si vous demandez le pardon, il l'accordera. Mes enfants, les guerres commenceront, ils prendront fin, mais ensuite ils continueront, prieront, car vous manquez de temps, laissez votre discours être, oui, oui non non. Je continue de venir vers vous pour vous instruire et vous vous détournez souvent. Mes enfants, croyez mes mots afin que vous soyez prêt, votre chemin sera plutôt ardu et impraticable, mais celui qui a le Saint Rosaire comme ancre sera sauvé. Enfants, suivez les dix commandements, regardez mon fils et vous verrez la lumière. Enfants, il y aura tout le temps un tremblement de terre fort, les nuages, mais je vous demande de prier sous la croix de mon fils et vous et vos familles vous serez bénie. Maintenant, je vous bénis au nom du Père et du Fils et du Saint-Esprit, Amen.",我的孩子们，谢谢您回应我心中的电话。我的孩子们，人类在边缘，请孩子们，回到上帝和他的律法上，他是仁慈的，如果您要求宽恕，他会授予它。我的孩子们，战争将开始，他们将结束，但是随后他们将继续，祈祷，因为您的时间没时间，让您的演讲是，是，是，否。我一直来找你指导你，你经常转身离开。我的孩子们，相信我的话，以便您可以做好准备，您的道路将相当艰巨且无法通行，但是任何拥有圣念珠作为锚的人都将得救。孩子们，跟随十诫，看我儿子，在那里你会看到光明。孩子们，将一直发生强烈的地震，云爆，但我要求您在儿子的十字架下祈祷，您和您的家人将受到祝福。现在，我以父，儿子和圣灵的名义祝福你。,"Meine Kinder, danke, dass Sie auf meinen Anruf in Ihrem Herzen geantwortet haben. Meine Kinder, die Menschheit ist am Rande, bitte Kinder, kehren zu Gott und zu seinen Gesetzen zurück, er ist barmherzig und wenn Sie um Vergebung bitten, wird er es gewähren. Meine Kinder, Kriege werden beginnen, sie werden enden, aber dann werden sie weitermachen, beten, denn Ihnen geht die Zeit aus, lassen Sie Ihre Rede sein, ja, nein nein. Ich komme immer wieder zu Ihnen, um Sie zu unterweisen, und Sie wenden sich oft ab. Meine Kinder, glauben meine Worte, damit Sie vorbereitet sind, Ihr Weg wird ziemlich mühsam und unpassierbar sein, aber wer auch immer den heiligen Rosenkranz als Anker hat, wird gerettet. Kinder, folgen Sie den zehn Geboten, schauen Sie zu meinem Sohn und dort sehen Sie das Licht. Kinder, es wird ständig ein starkes Erdbeben geben, Cloudbursts, aber ich bitte Sie, unter dem Kreuz meines Sohnes zu beten, und Sie und Ihre Familien werden gesegnet. Jetzt segne ich dich im Namen des Vaters und des Sohnes und des Heiligen Geistes, Amen.","Meus filhos, obrigado por responder à minha chamada em seus corações. Meus filhos, a humanidade está à beira, por favor, os filhos, voltem a Deus e suas leis, ele é misericordioso e, se você pedir perdão, ele concederá isso. Meus filhos, as guerras começarão, eles terminarão, mas depois continuarão, orando, pois você está ficando sem tempo, deixe seu discurso estar, sim sim, não não. Eu continuo vindo até você para instruí -lo e você costuma se afastar. Meus filhos, acreditam nas minhas palavras para que você esteja preparado, seu caminho será bastante árduo e intransitável, mas quem tiver o Santo Rosário como âncora será salvo. Filhos, siga os dez mandamentos, olhe para meu filho e lá você verá a luz. Filhos, haverá um forte terremoto, nuvem explosões o tempo todo, mas peço que você ore sob a cruz de meu filho e você e suas famílias serão abençoadas. Agora eu te abençoo em nome do Pai, do Filho e do Espírito Santo, Amém."
2022,8,13,Holy Mary,"Figli amati, grazie per essere qui, Io vi ho chiamati e voi avete risposto nel vostro cuore. Figli, pregate perché il tempo della purificazione è su di voi, pregate per la Chiesa e per i giovani perché le loro anime si stanno perdendo. Guardate i movimenti della terra, sono tutti segnali per voi. Figli miei, pregate con il cuore, non solo con le parole come facevano i Pagani, le vostre preghiere siano piene d’amore per il mio Divin Figlio, solo così potrete alleviare le nostre sofferenze. Ora vi benedico nel nome della Santissima Trinità, amen.",August,"Umiłowane dzieci, dziękuję wam za to, że jesteście tutaj, wezwałam was i odpowiedzieliście w swoich sercach. Dzieci moje, módlcie się, bo czas oczyszczenia jest blisko, módlcie się za Kościół i za młodzież, bo ich dusze są zagrożone. Spójrz na ruchy Ziemi, one wszystkie są dla ciebie znakami. Moje dzieci, módlcie się sercem, nie tylko słowami, jak czynili to poganie, niech wasze modlitwy będą pełne miłości do mojego Boskiego Syna, tylko w ten sposób możecie ulżyć naszym cierpieniom. Teraz błogosławię was w imię Trójcy Przenajświętszej, Amen.","Beloved children, thank you for being here, I have called you and you have responded in your hearts. Children, pray because the time of purification is upon you, pray for the Church and for the youth because their souls are being lost. Look at the movements of the Earth, they are all signs for you. My children, pray with your hearts, not only with words as the Pagans did, your prayers be full of love for my Divine Son, only in this way can you alleviate our sufferings. Now I bless you in the name of the Most Holy Trinity, Amen.","Amados hijos, gracias por estar aquí, te llamé y tú has respondido en tu corazón. Niños, rezan porque el momento de la purificación es sobre ti, reza por la iglesia y por los jóvenes porque sus almas se están perdiendo. Mira los movimientos de la Tierra, todos son signos para ti. Mis hijos, rezan con el corazón, no solo con palabras como lo hicieron los paganos, sus oraciones están llenas de amor por mi hijo divino, solo de esta manera puede aliviar nuestros sufrimientos. Ahora te bendiga en el nombre de la Santísima Trinidad, Amén.","Enfants bien-aimés, merci d'être ici, je vous ai appelé et vous avez répondu dans vos cœurs. Enfants, priez parce que le temps de purification est sur vous, priez pour l'église et pour les jeunes parce que leurs âmes sont perdues. Regardez les mouvements de la terre, ce sont tous des signes pour vous. Mes enfants, prient avec votre cœur, pas seulement avec des mots comme les païens l'ont fait, vos prières sont pleines d'amour pour mon fils divin, seulement de cette manière pouvez-vous atténuer nos souffrances. Maintenant, je vous bénis au nom de la Très Sainte Trinité, Amen.",心爱的孩子，谢谢您在这里，我打电话给您，您在心中回应。孩子们，祈祷是因为净化的时间到了，为教会和青年祈祷，因为他们的灵魂被迷失了。看看地球的动作，它们都是您的迹象。我的孩子们，用你的心祈祷，不仅像异教徒那样用言语祈祷，您的祈祷充满了对我神的儿子的爱，只有这样，您才能减轻我们的痛苦。现在，我以最圣洁的三位一体的名义祝福你。,"Geliebte Kinder, danke, dass du hier bist, ich habe dich angerufen und du hast in deinen Herzen geantwortet. Kinder, beten, weil die Zeit der Reinigung auf dir liegt, beten für die Kirche und für die Jugend, weil ihre Seelen verloren gehen. Schauen Sie sich die Bewegungen der Erde an, sie sind alle Zeichen für Sie. Meine Kinder beten mit Ihren Herzen, nicht nur mit Worten wie die Heiden, Ihre Gebete sind voller Liebe zu meinem göttlichen Sohn, nur auf diese Weise können Sie unsere Leiden lindern. Jetzt segne ich dich im Namen der heiligsten Dreifaltigkeit, Amen.","Filhos Amados, obrigado por estar aqui, liguei para você e você respondeu em seus corações. Filhos, ore porque o tempo da purificação está sobre você, ore pela igreja e pela juventude porque suas almas estão sendo perdidas. Olhe para os movimentos da Terra, todos são sinais para você. Meus filhos, orem com seus corações, não apenas com as palavras como os pagãos, suas orações estão cheias de amor pelo meu Filho Divino, apenas dessa maneira você pode aliviar nossos sofrimentos. Agora eu te abençoo em nome da Santíssima Trindade, Amém."
