year,month,day,author,text_it,month_string,text_pl,text_en,text_es,text_fr,text_zh,text_de,text_pt
2022,10,16,Holy Mary,"Cari figli, grazie per essere qui nella preghiera e per aver risposto alla mia chiamata nel vostro cuore. Figli miei, grazie per avermi permesso di stare qui con voi, per elargire tante benedizioni.  Pregate in questo luogo Benedetto insieme a questo mio figlio prediletto, innamorato di Gesù come il figlio di un padre (la Madonna si riferiva a Padre Giulio Maria Scozzaro). Figli, le strade saranno tortuose per arrivare a Gesù, ma avrete le benedizioni e la forza necessaria per sostenervi. Vi prego figli, siate fedeli alla Parola e al Vangelo. Ora vi benedico, nel Nome della Santissima Trinità: Padre e Figlio e Spirito Santo. La Madonna ha aggiunto che l’ultimo libro di Padre Giulio (Qual è la vera Chiesa di Cristo?) farà tremare i polsi ai cosiddetti figli di Dio. Ha anche detto: saranno tante le Grazie che scenderanno oggi. Durante la Messa, dopo la Consacrazione, mentre era tenuta elevata l’Eucaristia, Gisella ha visto San Pio da Pietrelcina all’altare, accanto e alla sinistra di Padre Giulio Scozzaro che celebrava la Messa e San Pio ha detto a Gisella: Sto preparando questo mio figlio alla Santità.",October,"Drogie dzieci, dziękuję wam, że jesteście tutaj na modlitwie i że odpowiadacie na moje wezwanie w waszych sercach. Moje dzieci, dziękuję wam, że pozwalacie mi być tutaj z wami, obdarzać was tak wieloma błogosławieństwami. Módl się w tym błogosławionym miejscu razem z moim ukochanym synem, który jest zakochany w Jezusie jak syn ojca (Matka Boża miała na myśli ojca Giulio Maria Scozzaro). Moje dzieci, drogi będą kręte, aby dotrzeć do Jezusa, ale będziecie mieli błogosławieństwa i siłę, która was podtrzyma. Proszę, moje dzieci, bądźcie wierne Słowu i Ewangelii. Teraz błogosławię was, w Imię Trójcy Przenajświętszej: Ojca i Syna i Ducha Świętego. Matka Boża dodała, że najnowsza książka ojca Giulio (Czym jest Prawdziwy Kościół Chrystusa?) sprawi, że tak zwane dzieci Boże będą drżeć. Powiedziała też: będzie dziś wiele Łask zstępujących. Podczas Mszy Świętej, po Konsekracji, gdy Eucharystia była trzymana wysoko, Gisella zobaczyła św. Pio z Pietrelciny przy ołtarzu, obok i na lewo od księdza Giulio Scozzaro, który odprawiał Mszę Świętą, a św. Pio powiedział do Giselli: Przygotowuję tego mojego syna do świętości.","Dear children, thank you for being here in prayer and for answering my call in your hearts. My children, thank you for allowing me to be here with you, to bestow so many blessings. Pray in this blessed place together with this beloved son of mine who is in love with Jesus like a father's son (Our Lady was referring to Father Giulio Maria Scozzaro). Children, the roads will be winding to get to Jesus, but you will have the blessings and strength to sustain you. Please children, be faithful to the Word and the Gospel. I bless you now, in the Name of the Most Holy Trinity: Father and Son and Holy Spirit. Our Lady added that Father Giulio' latest book (What is the True Church of Christ?) will make the so-called children of God shake in their boots. She also said, there will be many Graces descending today. During Mass, after the Consecration, while the Eucharist was being held high, Gisella saw St. Pio of Pietrelcina at the altar, next to and to the left of Father Giulio Scozzaro who was celebrating Mass, and St. Pio said to Gisella: I am preparing this son of mine for Holiness.","Queridos hijos, gracias por estar aquí en oración y por haber respondido mi llamada en tu corazón. Mis hijos, gracias por permitirme quedarme aquí con ustedes, para dar muchas bendiciones. Ore en este lugar Benedetto junto con este hijo favorito, enamorado de Jesús como el Hijo de un Padre (la Virgen se refirió al Padre Giulio Maria Scozzaro). Niños, los caminos serán sinuosos para llegar a Jesús, pero tendrás las bendiciones y la fuerza necesarias para apoyarte. Por favor, niños, sean fieles a la Palabra y al Evangelio. Ahora te bendiga, en el nombre de la Santísima Trinidad: Padre e Hijo y Espíritu Santo. La Madonna agregó que el último libro del Padre Giulio (¿cuál es la verdadera Iglesia de Cristo?) Hará que las muñecas temblarán a los So -Ledled Children of Dios. También dijo: Habrá muchas gracias que se reducirán hoy. Durante la misa, después de la consagración, mientras que la Eucaristía se mantuvo en alto, Gisella vio a San Pio da Pietrelcina en el altar, el siguiente y la izquierda del padre Giulio Sczzaro, quien celebró misa y San Pio le dijo a Gisella: Estoy preparando esto mi hijo para Hantines .","Chers enfants, merci d'être ici dans la prière et d'avoir répondu à mon appel dans votre cœur. Mes enfants, merci de m'avoir permis d'être ici avec vous, pour accorder tant de bénédictions. Priez dans cet endroit béni avec ce fils bien-aimé qui est amoureux de Jésus comme le fils d'un père (Notre-Dame faisait référence au père Giulio Maria Scozzaro). Enfants, les routes seront enroulées pour se rendre à Jésus, mais vous aurez les bénédictions et la force pour vous soutenir. S'il vous plaît les enfants, soyez fidèle à la Parole et à l'Évangile. Je vous bénis maintenant, au nom de la Très Sainte Trinité: Père et Fils et Saint-Esprit. Notre-Dame a ajouté que le dernier livre du père Giulio (quelle est la vraie église du Christ?) Foura les soi-disant enfants de Dieu secouer dans leurs bottes. Elle a également déclaré qu'il y aura de nombreuses grâces descendant aujourd'hui. Pendant la messe, après la consécration, alors que l'Eucharistie était retenue haut, Gisella a vu Saint-Pio de Pietrelcina à l'autel, à côté de et à gauche du père Giulio Scozzaro qui célébrait la messe, et St. Pio a dit à Gisella: I Je prépare ce fils à moi pour la sainteté.",亲爱的孩子们，感谢您在这里祈祷并在您的心中接我的电话。我的孩子们，感谢您允许我与您在一起，给予很多祝福。与这个心爱的儿子一起在这个有福的地方祈祷，他像父亲的儿子一样爱上耶稣（我们的女士指的是朱利奥·玛丽亚·斯科扎罗神父）。孩子们，道路将绕着耶稣来到耶稣，但是您将有维持您的祝福和力量。请孩子们忠于圣言和福音。我现在以最圣洁的三位一体的名义祝福你：父子和圣灵。我们的夫人补充说，朱利奥神父的最新著作（真正的基督教会是什么？）会让所谓的上帝的孩子摇晃他们的靴子。她还说，今天将有很多恩典下降。在弥撒期间，在奉献之后，当圣体圣事被高高地举行时，吉塞拉在祭坛上看到了彼得雷尔西纳的圣皮奥，在庆祝弥撒的吉利奥·斯科扎罗神父旁边，左右，圣皮奥对吉赛拉说：我一我正在为我的儿子准备圣洁。,"Liebe Kinder, danke, dass du hier im Gebet bist und meinen Anruf in deinen Herzen beantwortet hast. Meine Kinder, danke, dass Sie mir erlaubt haben, hier bei Ihnen zu sein und so viele Segen zu schenken. Bete an diesem gesegneten Ort zusammen mit diesem geliebten Sohn von mir, der in Jesus verliebt ist wie der Sohn eines Vaters (unsere Frau bezog sich auf Pater Giulio Maria Scozzaro). Kinder, die Straßen werden sich auf Jesus umgeben, aber Sie werden den Segen und die Kraft haben, um Sie zu erhalten. Bitte Kinder, seien Sie dem Wort und dem Evangelium treu. Ich segne dich jetzt im Namen der heiligsten Dreifaltigkeit: Vater und Sohn und Heiliger Geist. Unsere Lieben Frau fügte hinzu, dass Pater Giulio 'neuestes Buch (was ist die wahre Kirche Christi?) Die sogenannten Kinder Gottes in ihren Stiefeln zittern lassen. Sie sagte auch, es werde heute viele Gnaden geben. Während der Messe sah Gisella nach der Weihe, während die Eucharistie hoch gehalten wurde Bereite diesen Sohn von mir auf die Heiligkeit vor.","Caros filhos, obrigado por estar aqui em oração e por atender minha chamada em seus corações. Meus filhos, obrigado por me permitir estar aqui com você, conceder tantas bênçãos. Ore neste lugar abençoado junto com este meu amado filho meu que está apaixonado por Jesus como o filho de um pai (Nossa Senhora estava se referindo ao padre Giulio Maria Scozzaro). Filhos, as estradas estarão enroladas para chegar a Jesus, mas você terá as bênçãos e a força para sustentá -lo. Por favor, crianças, sejam fiéis à palavra e ao evangelho. Eu te abençoo agora, em nome da Santíssima Trindade: Pai, Filho e Espírito Santo. Nossa Senhora acrescentou que o último livro do padre Giulio (qual é a verdadeira Igreja de Cristo?) Fará os chamados filhos de Deus sacudirem em suas botas. Ela também disse que haverá muitas graças descendentes hoje. Durante a missa, após a consagração, enquanto a Eucaristia estava sendo mantida, Gisella viu St. Pio de Pietrelcina no altar, ao lado e à esquerda do padre Giulio Scozzaro, que estava comemorando a missa, e St. Pio disse a Gisella: Eu Estou preparando esse meu filho para a santidade."
2022,10,18,Holy Mary,"Cara figlia, grazie per avermi accolta nel tuo cuore. Devi dire al mondo di prepararsi spiritualmente dagli attacchi del demonio, l’umanità piangerà e striderà i denti. Chiedo di fare riparazione per tutte le offese al mio diletto Figlio. Parlo attraverso quest’anima prediletta, vi mostro i segni della mia presenza eppure molti figli sono sordi alla mia chiamata. L’umanità non capisce ancora che le offese, le blasfemie, i sacrilegi compiuti anche dai miei figli prediletti (Sacerdoti) sarà la loro condanna eterna. Vivono delle cose materiali senza osservare tutte le cose del cielo. Figli, siate umili, piegate sempre le vostre ginocchia nella preghiera, vivete i Comandamenti e cibatevi del Corpo e del Sangue del Redentore. Ora vi benedico nel Nome del Padre e del Figlio e dello Spirito Santo. Amen.",October,"Drogie dziecko, dziękuję ci za przyjęcie mnie do swojego serca. Musisz powiedzieć światu, aby przygotował się duchowo na ataki diabła; ludzkość będzie płakać i zgrzytać zębami. Proszę o zadośćuczynienie za wszystkie przewinienia wobec mojego ukochanego Syna. Przemawiam przez tę ukochaną duszę, ukazuję wam znaki mojej obecności, a jednak wiele dzieci jest głuchych na moje wezwanie. Ludzkość wciąż nie rozumie, że wykroczenia, bluźnierstwa, świętokradztwa popełniane nawet przez Moje umiłowane dzieci (kapłanów) będą ich wiecznym potępieniem. Żyją sprawami materialnymi, nie dostrzegając spraw niebieskich. Dzieci moje, bądźcie pokorne, zawsze klękajcie do modlitwy, żyjcie przykazaniami i karmcie się Ciałem i Krwią Odkupiciela. Teraz błogosławię was w Imię Ojca i Syna i Ducha Świętego, Amen.","Dear daughter, thank you for welcoming me into your heart. You must tell the world to prepare itself spiritually from the devil's attacks; humanity will weep and gnash its teeth. I ask to make reparation for all offenses against my beloved Son. I speak through this beloved soul, I show you the signs of my presence and yet many children are deaf to my call. Humanity still does not understand that the offenses, blasphemies, sacrileges done even by my beloved children (Priests) will be their eternal condemnation. They live on material things without observing all the things of Heaven. My children, be humble, always bend your knees in prayer, live the Commandments and feed on the Body and Blood of the Redeemer. Now I bless you in the Name of the Father and the Son and the Holy Spirit, Amen.","Querida hija, gracias por darme la bienvenida en tu corazón. Tienes que decirle al mundo que se prepare espiritualmente de los ataques del diablo, la humanidad llorará y replyará los dientes. Pido reparar todas las ofensas a mi querido hijo. Hablo a través de esta alma favorita, te muestro los signos de mi presencia y, sin embargo, muchos niños son sordos a mi llamada. La humanidad todavía no entiende que las ofensas, las blasfemias, los sacrilizos también hechos por mis hijos favoritos (sacerdotes) serán su condena eterna. Viven cosas materiales sin observar todas las cosas en el cielo. Hijos, sean humildes, siempre dobla las rodillas en la oración, viven los mandamientos y se alimentan del cuerpo y la sangre del redentor. Ahora te bendiga en el nombre del Padre y el Hijo y el Espíritu Santo. Amén.","Chère fille, merci de m'avoir accueilli dans votre cœur. Vous devez dire au monde de se préparer spirituellement à partir des attaques du diable; L'humanité pleurera et grincera ses dents. Je demande de réparer toutes les infractions contre mon fils bien-aimé. Je parle à travers cette âme bien-aimée, je vous montre les signes de ma présence et pourtant de nombreux enfants sont sourds à mon appel. L'humanité ne comprend toujours pas que les infractions, les blasphèmes, les sacrilèges effectués même par mes enfants bien-aimés (prêtres) seront leur condamnation éternelle. Ils vivent sur des choses matérielles sans observer toutes les choses du ciel. Mes enfants, soyez humble, pliez toujours vos genoux dans la prière, vivent les commandements et se nourrissent du corps et du sang du rédempteur. Maintenant, je vous bénis au nom du Père et du Fils et du Saint-Esprit, Amen.",亲爱的女儿，谢谢你欢迎我进入你的心。您必须告诉世界从魔鬼的袭击中精神上做好准备。人类会哭泣和咬牙。我要求对我心爱的儿子的所有罪行进行赔偿。我通过这个心爱的灵魂讲话，向您展示我的存在的迹象，但许多孩子对我的电话充耳不闻。人类仍然不明白，即使是我心爱的孩子（牧师）所做的犯罪，亵渎，祭祀，也是他们永恒的谴责。他们生活在物质上，而没有观察天堂的所有事物。我的孩子们，谦虚，总是在祈祷中弯腰，遵守诫命，并以救赎主的身体和鲜血为食。现在，我以父，儿子和圣灵的名义祝福你。,"Liebe Tochter, danke, dass du mich in deinem Herzen willkommen geheißen hast. Sie müssen der Welt sagen, sie soll sich geistig von den Angriffen des Teufels vorbereiten. Die Menschheit wird seine Zähne weinen und knirschen. Ich bitte um die Wiedergutmachung für alle Straftaten gegen meinen geliebten Sohn. Ich spreche durch diese geliebte Seele, ich zeige dir die Zeichen meiner Anwesenheit und doch sind viele Kinder meinen Anruf taub. Die Menschheit versteht immer noch nicht, dass die Straftaten, Blasphemen und Sakrilegien auch von meinen geliebten Kindern (Priestern) ihre ewige Verurteilung sein werden. Sie leben von materiellen Dingen, ohne alle Dinge des Himmels zu beobachten. Meine Kinder, seien Sie demütig, beugen Sie immer Ihre Knie im Gebet, leben Sie die Gebote und ernähren sich vom Körper und Blut des Erlösers. Jetzt segne ich dich im Namen des Vaters und des Sohnes und des Heiligen Geistes, Amen.","Querida filha, obrigado por me receber em seu coração. Você deve dizer ao mundo para se preparar espiritualmente dos ataques do diabo; A humanidade chorará e gna os dentes. Peço para fazer reparação por todas as ofensas contra meu amado filho. Falo através dessa amada alma, mostro os sinais da minha presença e, no entanto, muitas crianças são surdas para o meu chamado. A humanidade ainda não entende que as ofensas, blasfêmias, sacriles feitos até meus amados filhos (sacerdotes) serão sua condenação eterna. Eles vivem com coisas materiais sem observar todas as coisas do céu. Meus filhos, sejam humildes, sempre dobram os joelhos em oração, vivem os mandamentos e se alimentam do corpo e do sangue do Redentor. Agora eu te abençoo em nome do Pai, do Filho e do Espírito Santo, Amém."
2022,10,23,Holy Mary,"Figli miei, oggi, tante saranno le grazie che scenderanno e tanti raggi luminosi entreranno nelle vostre vite. Io stessa, durante l’Eucarestia, passerò tra voi per benedirvi uno alla volta,nel nome del Padre, del Figlio e dello Spirito Santo, amen.",October,"Moje dzieci, dziś zstąpi wiele łask i wiele promieni światła wejdzie w wasze życie. Ja sama, podczas Eucharystii, przejdę między wami, aby was kolejno pobłogosławić, w imię Ojca i Syna i Ducha Świętego, Amen.","My children, today, so many graces will descend and so many rays of light will enter your lives. I myself, during the Eucharist, will pass among you to bless you one by one,in the name of the Father and the Son and the Holy Spirit, Amen.","Mis hijos, hoy, muchas gracias que disminuirán y muchos rayos de luz entrarán en sus vidas. Yo mismo, durante la Eucaristía, pasaré entre ustedes para bendecirte uno a la vez, en nombre del Padre, el Hijo y el Espíritu Santo, Amén.","Mes enfants, aujourd'hui, tant de grâces descendreont et tant de rayons de lumière entreront dans votre vie. Moi-même, pendant l'Eucharistie, je passerai parmi vous pour vous bénir un par un, au nom du Père et du Fils et du Saint-Esprit, Amen.",今天，我的孩子们会下降，这么多的恩典将进入您的生命。我本人，在圣体圣事期间，我将以父亲和儿子和圣灵的名义，阿们的名义来传递你们中间。,"Meine Kinder werden heute so viele Gnaden absteigen und so viele Lichtstrahlen werden in Ihr Leben eintreten. Ich selbst, während der Eucharistie, werde unter Ihnen gehen, um Sie nacheinander im Namen des Vaters und des Sohnes und des Heiligen Geistes Amen zu segnen.","Hoje, meus filhos, tantas graças descem e tantos raios de luz entrarão em suas vidas. Eu mesmo, durante a Eucaristia, passarei entre você para abençoá -lo um por um, em nome do Pai, do Filho e do Espírito Santo, Amém."
2022,10,25,Holy Mary,"Cari figli, grazie per essere qui nella preghiera e per aver piegato le vostre ginocchia.  Figli miei, guardate intorno a voi questo mondo malato. Molti pensano che questo tempo sia la fine, ma molto peggio arriverà, non immaginate quanto il demonio possa essere crudele. Molti di voi dicono di conoscere mio Figlio Gesù, con la bocca, ma non con il cuore. Figlia mia, scelta e prediletta da Dio, riceverai presto dal mio Giglio, il manto della gloria e la spada della giustizia, affinché tutto sia per la gloria di Dio. Gesù è con te. Figli, siate sempre pronti per la guerra spirituale che sarà faticosa, ma i miei angeli combatteranno per voi. Figli vi benedico e la pace sia con voi, amen.",October,"Drogie dzieci, dziękuję wam, że jesteście tutaj na modlitwie i że klęczycie. Moje dzieci, spójrzcie na ten chory świat wokół siebie. Wielu myśli, że ten czas jest końcem, ale przyjdzie jeszcze wiele zła, nie wyobrażacie sobie, jak okrutny potrafi być diabeł. Wielu z was mówi, że zna mojego Syna Jezusa, ale nie zna Go swoim sercem. Moja córko, wybrana i umiłowana przez Boga, wkrótce otrzymasz od mojej Lilię, Płaszcz Chwały i Miecz Sprawiedliwości, aby wszystko było na chwałę Boga. Jezus jest z tobą. Dzieci, bądźcie zawsze gotowi na walkę duchową, która będzie męcząca, jednak moi aniołowie będą walczyć za was. Dzieci, błogosławię was i pokój niech będzie z wami, Amen.","Dear children, thank you for being here in prayer and for kneeling down.  My children, look around you at this sick world. Many think this time is the end, but much worse will come, you cannot imagine how cruel the devil can be. Many of you say you know my Son Jesus, with your mouth, but not with your heart. My daughter, chosen and beloved of God, you will soon receive from my Lily, the Mantle of Glory and the Sword of Righteousness, so that everything may be for the glory of God. Jesus is with you. Children, always be ready for the spiritual warfare that will be tiring, but my angels will fight for you. Children, I bless you and peace be with you, Amen.","Queridos hijos, gracias por estar aquí en oración y por haber doblado las rodillas. Mis hijos, miran a tu alrededor este mundo enfermo. Muchos piensan que esta vez es el final, pero mucho peor, no imaginen cuán cruel puede ser el diablo. Muchos de ustedes dicen que conocen a mi hijo Jesús, con la boca, pero no con el corazón. Mi hija, la elección y la favorita de Dios, pronto recibirán de mi lirio, la capa de gloria y la espada de la justicia, para que todo sea para la gloria de Dios. Jesús está contigo. Niños, prepárate para la guerra espiritual que será agotador, pero mis ángeles lucharán por ti. Los niños te bendicen y la paz sea contigo, Amén.","Chers enfants, merci d'être ici dans la prière et de s'agenouiller. Mes enfants, regardez autour de vous ce monde malade. Beaucoup pensent que cette fois est la fin, mais bien pire, vous ne pouvez pas imaginer à quel point le diable peut être cruel. Beaucoup d'entre vous disent que vous connaissez mon fils Jésus, avec votre bouche, mais pas avec votre cœur. Ma fille, choisie et appréciée de Dieu, vous recevrez bientôt de mon lis, du manteau de gloire et de l'épée de la justice, afin que tout soit pour la gloire de Dieu. Jésus est avec vous. Les enfants, soyez toujours prêts pour la guerre spirituelle qui sera fatigante, mais mes anges se battront pour vous. Enfants, je vous bénis et que la paix soit avec vous, Amen.",亲爱的孩子们，谢谢您在这里祈祷和跪下。我的孩子们，环顾这个病世界。许多人认为这次是终结，但是更糟的是，您无法想象魔鬼会多么残酷。你们中的许多人说，你认识我的儿子耶稣，嘴巴，但不要心中。我的女儿是上帝的选择和挚爱，您很快就会从我的百合，荣耀的披风和公义之剑那里得到，这样一切可能都是为了上帝的荣耀。耶稣与你同在。孩子们，请始终为会感到疲倦的精神战做好准备，但我的天使会为您而战。孩子们，我祝福你，和平与你同在，阿们。,"Liebe Kinder, danke, dass du hier im Gebet bist und dich niedergekniet. Meine Kinder, sehen sich in dieser kranken Welt um. Viele denken, dass diesmal das Ende ist, aber viel schlimmer wird kommen, Sie können sich nicht vorstellen, wie grausam der Teufel sein kann. Viele von Ihnen sagen, dass Sie meinen Sohn Jesus kennen, mit Ihrem Mund, aber nicht mit Ihrem Herzen. Meine Tochter, gewählt und geliebt von Gott, werden Sie bald von meiner Lilie, dem Mantel der Herrlichkeit und dem Schwert der Gerechtigkeit, empfangen, damit alles für die Herrlichkeit Gottes sein kann. Jesus ist bei dir. Kinder, sein immer bereit für den spirituellen Krieg, der anstrengend sein wird, aber meine Engel werden für Sie kämpfen. Kinder, ich segne dich und Friede sei mit dir, Amen.","Caros filhos, obrigado por estar aqui em oração e por se ajoelhar. Meus filhos, olhe ao seu redor para este mundo doente. Muitos pensam que desta vez é o fim, mas muito pior chegará, você não pode imaginar o quão cruel o diabo pode ser. Muitos de vocês dizem que conhece meu filho Jesus, com sua boca, mas não com seu coração. Minha filha, escolhida e amada por Deus, você em breve receberá do meu lírio, o manto da glória e a espada da justiça, para que tudo possa ser para a glória de Deus. Jesus está com você. Filhos, sempre estejam prontos para a guerra espiritual que será cansativa, mas meus anjos lutarão por você. Filhos, eu abençoo você e a paz esteja com você, Amém."
