year,month,day,author,text_it,month_string,text_pl,text_en,text_es,text_fr,text_zh,text_de,text_pt
2022,10,3,Holy Mary,"Cari figli miei, grazie per essere qui nella preghiera e per aver piegato le vostre ginocchia. Figli benedetti, la vostra umile preghiera conforta me e il mio Gesù. Figli miei, non temete per ciò che arriverà perché Io ho già steso il Mio Manto qui, oggi e su tutti coloro che hanno la vera fede. Figli, cibatevi del corpo e del sangue di mio Figlio Gesù, Lui lo ha lasciato per voi, non nel ricordo, ma nella sua presenza vera e viva. Figli, fate in modo che il modernismo della Chiesa non vi contamini, siate fedeli al vero magistero della Fede. Gesù vi guarda e vi manda lo Spirito di discernimento su ciò che è giusto, che è di Dio e su ciò che apre le porte per arrivare nell’abisso di Satana. Figli miei, Io sono con voi e non vi abbandonerò mai. Percorrete la via della santità. Ora vi benedico nel nome del Padre, del Figlio e dello Spirito Santo. Poi la Madonna ha aggiunto che scenderanno tante grazie su coloro che pregheranno la coroncina al preziosissimo sangue di Gesù.",October,"Moje drogie dzieci, dziękuję wam, że jesteście tutaj na modlitwie i że uklęknęliście. Błogosławione dzieci, wasza pokorna modlitwa pociesza mnie i mojego Jezusa. Moje dzieci, nie lękajcie się o to, co ma nadejść, ponieważ Ja już rozpostarłam Mój Płaszcz teraz, tutaj i nad wszystkimi, którzy mają prawdziwą wiarę. Moje dzieci, karmcie się Ciałem i Krwią mojego Syna Jezusa, On zostawił je dla was nie na pamiątkę, ale dla swojej prawdziwej i żywej obecności. Moje dzieci, dopilnujcie, aby modernizm Kościoła nie splugawił was, bądźcie wierni prawdziwemu Magisterium Wiary. Jezus obserwuje cię i posyła ci Ducha rozeznania tego, co jest właściwe, co jest z Boga, a tego, co otwiera drzwi do otchłani szatana. Moje dzieci, jestem z wami i nigdy was nie opuszczę. Idźcie drogą świętości. Teraz błogosławię was w imię Ojca i Syna i Ducha Świętego. Następnie Matka Boża dodała, że na tych, którzy odmawiają koronkę do Najdroższej Krwi Pana Jezusa, zstąpi wiele łask.","My dear children, thank you for being here in prayer and for kneeling down. Blessed children, your humble prayer comforts Me and My Jesus. My children, do not fear for what is to come for I have already spread My Mantle here today and over all who have the true faith. My children, feed yourselves on the body and blood of My Son Jesus, He left it for you, not in remembrance, but in His true and living presence. Children, see to it that the modernism of the Church does not defile you; be faithful to the true Magisterium of the Faith. Jesus is watching you and sending you the Spirit of discernment about what is right, what is of God and what opens the doors to reach into the abyss of Satan. My children, I am with you and will never abandon you. Walk the path of holiness. Now I bless you in the name of the Father and the Son and the Holy Spirit. Then Our Lady added that many graces will descend on those who pray the chaplet to the Most Precious Blood of Jesus.","Queridos hijos, gracias por estar aquí en oración y por haber doblado las rodillas. Los niños de Benedetti, su humilde oración me consuela a mí y a mi Jesús. Mis hijos, no temen lo que vendrá porque ya he difundido mi abrigo aquí, hoy y de todos aquellos que tienen verdadera fe. Niños, comida del cuerpo y sangre de mi hijo Jesús, lo dejó por ti, no en la memoria, sino en su presencia verdadera y viva. Niño, asegúrese de que el modernismo de la iglesia no lo contamine, sea fiel al verdadero magisterio de la fe. Jesús te mira y te envía el espíritu de discernimiento sobre lo que es correcto, que es de Dios y lo que abre las puertas para llegar al abismo de Satanás. Mis hijos, estoy contigo y nunca te abandonaré. Viaja por el camino de la santidad. Ahora te bendiga en el nombre del Padre, el Hijo y el Espíritu Santo. Luego, la Madonna agregó que muchas gracias pasarán a quienes rezarán a la corona a la preciosa sangre de Jesús.","Mes chers enfants, merci d'être ici dans la prière et de s'agenouiller. Enfants bénis, votre humble prière réconforte moi et mon Jésus. Mes enfants, ne craignez pas ce qui est à venir car j'ai déjà diffusé mon manteau ici aujourd'hui et à tous ceux qui ont la vraie foi. Mes enfants, vous nourrissez du corps et du sang de mon fils Jésus, il l'a laissé pour vous, non pas en souvenir, mais dans sa présence vraie et vivante. Les enfants, veillent à ce que le modernisme de l'Église ne vous soulève pas; Soyez fidèle au vrai magistère de la foi. Jésus vous regarde et vous envoie l'esprit de discernement sur ce qui est juste, ce qui est de Dieu et ce qui ouvre les portes à atteindre dans l'abîme de Satan. Mes enfants, je suis avec vous et je ne vous abandonnerai jamais. Suivre le chemin de la sainteté. Maintenant, je vous bénis au nom du Père et du Fils et du Saint-Esprit. Ensuite, Notre-Dame a ajouté que de nombreuses grâces descendent sur ceux qui prient le chaplet au sang le plus précieux de Jésus.",我亲爱的孩子们，感谢您在这里祈祷和跪下。祝福的孩子，你谦虚的祈祷安慰我和我的耶稣。我的孩子们，不要担心会发生什么，因为我今天已经在这里和所有具有真正信仰的人都散布了我的地幔。我的孩子们，养活自己的儿子耶稣的身体和鲜血，他把它留给你，不是纪念的，而是在他真实而活的存在下。孩子们，请注意，教会的现代主义不会de毁你。忠于信仰的真正杂志。耶稣在看着你，向你发送了关于什么是正确的，什么是上帝的精神，以及打开门的东西进入撒旦的深渊。我的孩子们，我和你在一起，永远不会抛弃你。走圣洁的道路。现在，我以父，儿子和圣灵的名义祝福你。然后我们的夫人补充说，许多恩赐将降落在那些祈祷耶稣最宝贵之血的人身上。,"Meine lieben Kinder, danke, dass du hier im Gebet bist und dich niedergekniet. Gesegte Kinder, dein bescheidenes Gebet tröstet mich und meinen Jesus. Meine Kinder, fürchte nicht, was kommen wird, ich habe meinen Mantel heute und über alle, die den wahren Glauben haben, bereits hier verbreitet. Meine Kinder füttern sich auf den Körper und das Blut meines Sohnes Jesus, er hat es Ihnen hinterlassen, nicht in Erinnerung, sondern in seiner wahren und lebenden Gegenwart. Kinder, sehen Sie, dass die Moderne der Kirche Sie nicht verunreinigt; Sei dem wahren Lehramt des Glaubens treu. Jesus beobachtet dich und sendet dir den Geist der Unterscheidung darüber, was richtig ist, was von Gott ist und was die Türen öffnet, um in den Abgrund des Satans zu greifen. Meine Kinder, ich bin bei dir und werde dich niemals verlassen. Gehen Sie den Weg der Heiligkeit. Jetzt segne ich dich im Namen des Vaters und des Sohnes und des Heiligen Geistes. Dann fügten unsere Lieben Frau hinzu, dass viele Gnaden auf diejenigen hinabsteigen, die den Chaplet zum kostbarsten Blut Jesu beten.","Meus queridos filhos, obrigado por estar aqui em oração e por se ajoelhar. Filhos abençoados, sua humilde oração conforta a mim e ao meu Jesus. Meus filhos, não temem o que está por vir, eu já espalhei meu manto aqui hoje e sobre todos os que têm a verdadeira fé. Meus filhos, alimentam -se com o corpo e o sangue do meu filho Jesus, ele deixou para você, não em lembrança, mas em sua presença verdadeira e viva. Filhos, para que o modernismo da igreja não o perverse; Seja fiel ao verdadeiro magistério da fé. Jesus está observando você e enviando o espírito de discernimento sobre o que é certo, o que é de Deus e o que abre as portas para alcançar o abismo de Satanás. Meus filhos, estou com você e nunca vou te abandonar. Ande o caminho da santidade. Agora eu te abençoo em nome do Pai, do Filho e do Espírito Santo. Então Nossa Senhora acrescentou que muitas graças descerem sobre aqueles que oram o chapelar ao sangue mais precioso de Jesus."
2022,10,7,Holy Mary,"Cari figli Benedetti, grazie per essere qui e per aver piegato le ginocchia nella preghiera. Figli miei, Io sono la Regina del Rosario, del cielo e della terra e vi chiedo di intensificare la recita dei rosari e pregate insieme ai bambini, proteggetevi dal male che attanaglia il mondo. Figli, pregate per la Corea, pregate per i governanti che stanno prendendo decisioni sbagliate, pregate per i santi sacerdoti massacrati dagli attacchi. Figli miei, vi chiedo di Consacrarvi al mio Cuore Immacolato, per la vostra protezione. Ora vi benedico nel nome del Padre, del Figlio e dello Spirito Santo, amen.",October,"Drogie błogosławione dzieci, dziękuję wam, że jesteście tutaj i że uklęknęliście do modlitwy. Moje dzieci, jestem Królową Różańca, nieba i ziemi, i proszę was, abyście zintensyfikowali odmawianie różańców i modląc się razem z dziećmi, chronili się przed złem, które ogarnia świat. Moje dzieci, módlcie się za Koreę, módlcie się za rządzących, którzy podejmują złe decyzje, módlcie się za świętych kapłanów zmasakrowanych atakami. Moje dzieci, proszę was, abyście poświęcili się mojemu Niepokalanemu Sercu, dla waszej ochrony. Teraz błogosławię was w imię Ojca i Syna i Ducha Świętego, Amen.","Dear blessed children, thank you for being here and for kneeling in prayer. My children, I am the Queen of the Rosary, of heaven and earth and I ask you to intensify the recitation of rosaries and pray together with the children, protect yourselves from the evil that grips the world. My children, pray for Korea, pray for the rulers who are making wrong decisions, pray for the holy priests massacred by attacks. My children, I ask you to Consecrate yourselves to my Immaculate Heart, for your protection. Now I bless you in the name of the Father and the Son and the Holy Spirit, Amen.","Queridos niños benditos, gracias por estar aquí y por haber doblado las rodillas en oración. Mis hijos, soy la reina del rosario, del cielo y la tierra y les pido que intensifique la recitación de los rosarios y reza con los niños, protégase del mal que se ajusta al mundo. Los niños, rezan por Corea, rezan por los gobernantes que están tomando decisiones equivocadas, rezan por los santos sacerdotes masacrados por los ataques. Mis hijos, les pido que lo consagren para mi corazón inmaculado para su protección. Ahora te bendigo en el nombre del Padre, el Hijo y el Espíritu Santo, Amén.","Chers enfants bénis, merci d'être ici et d'être à genoux dans la prière. Mes enfants, je suis la reine du chapelet, du ciel et de la terre et je vous demande d'intensifier la récitation des chapelets et de prier avec les enfants, de vous protéger du mal qui saisit le monde. Mes enfants, priez pour la Corée, priez pour les dirigeants qui prennent de mauvaises décisions, priez pour les saints prêtres massacrés par des attaques. Mes enfants, je vous demande de vous consacrer à mon cœur immaculé, pour votre protection. Maintenant, je vous bénis au nom du Père et du Fils et du Saint-Esprit, Amen.",亲爱的祝福的孩子们，谢谢您在这里并跪着祈祷。我的孩子们，我是念珠的皇后，天地的女王，我请您加强念珠的朗诵，并与孩子们一起祈祷，保护自己免受世界遭受世界的邪恶的侵害。我的孩子们为韩国祈祷，为做出错误决定的统治者祈祷，为被袭击屠杀的圣母祈祷。我的孩子们，我要你奉献自己的心脏，以保护自己，以保护自己。现在，我以父，儿子和圣灵的名义祝福你。,"Liebe gesegnete Kinder, danke, dass Sie hier sind und im Gebet knien. Meine Kinder, ich bin die Königin des Rosenkranzes, des Himmels und der Erde und ich bitte Sie, die Rezitation von Rosenkränzen zu intensivieren und zusammen mit den Kindern zu beten, sich vor dem Bösen zu schützen, das die Welt greift. Meine Kinder, beten für Korea, beten für die Herrscher, die falsche Entscheidungen treffen, beten für die heiligen Priester, die durch Angriffe massakriert werden. Meine Kinder, ich bitte Sie, sich für Ihren Schutz an mein makelloses Herz zu weihen. Jetzt segne ich dich im Namen des Vaters und des Sohnes und des Heiligen Geistes, Amen.","Caros filhos abençoados, obrigado por estar aqui e por ajoelhar -se em oração. Meus filhos, sou a rainha do rosário, do céu e da terra e peço que você intensifique a recitação de rosários e ore junto com as crianças, protege -se do mal que segura o mundo. Meus filhos, oram pela Coréia, orem pelos governantes que estão tomando decisões erradas, orem pelos sagrados sacerdotes massacrados por ataques. Meus filhos, peço que você se consagre ao meu coração imaculado, para sua proteção. Agora eu te abençoo em nome do Pai, do Filho e do Espírito Santo, Amém."
2022,10,11,Holy Mary,"Figli miei. grazie per aver risposto alla mia chiamata nel vostro cuore e per aver piegato le ginocchia nella preghiera. Figli miei, quanto soffre il mio cuore per l’umanità che si trova in bilico. Figli, voi che siete i risvegliati, risvegliate le coscienze dei vostri fratelli e pregate per le vostre anime. L’umanità ha cambiato l’amore con l’odio, la preghiera con la bestemmia, il dono che ha lasciato Dio per voi ( l’Eucarestia), ormai è qualcosa senza significato. Figli, questo è il tempo di grazia e tanti saranno i miracoli che accadranno, pregate affinché Dio abbia misericordia. Le grandi potenze si stanno attaccando tra loro a causa della vicinanza di tanti demoni, che li stanno guidando alla grande guerra. L’Italia patirà la fame, ma voi, figli miei, siate uniti sempre nel nome del Signore e fidatevi solo di Lui, perché solo in Lui sarà la vittoria. Fate cenacoli di preghiera anche nelle famiglie, consacratevi al mio Cuore Immacolato ed Io vi proteggerò. Figli, siete attratti da false luci e da grandi invenzioni, ma quando tutto crollerà, la delusione sarà enorme, aprite il cuore e pregate. Ora vi benedico, nel nome del Padre, del Figlio e dello Spirito Santo,amen.",October,"Moje dzieci, dziękuję wam, że odpowiadacie na moje wezwanie w waszych sercach i że uklęknęliście do modlitwy. Moje dzieci, jak bardzo moje serce boli z powodu ludzkości, która jest w zawieszeniu. Moje dzieci, wy, którzy jesteście przebudzeni, obudźcie sumienia waszych braci i módlcie się za wasze dusze. Ludzkość zamieniła miłość na nienawiść, modlitwę na bluźnierstwo, dar, który Bóg zostawił dla ciebie (Eucharystia), jest teraz czymś bez znaczenia. Moje dzieci, to jest czas łaski i wiele cudów się wydarzy, módlcie się, aby Bóg się zmiłował. Wielkie mocarstwa atakują się wzajemnie z powodu bliskości tak wielu demonów, które prowadzą je do wielkiej wojny. Włochy będą głodne, ale wy, moje dzieci, bądźcie zawsze zjednoczeni w imię Pana i ufajcie tylko Jemu, bo tylko w Nim będzie zwycięstwo. Twórzcie kręgi modlitewne także w waszych rodzinach, poświęćcie się mojemu Niepokalanemu Sercu, a Ja będę was chronić. Moje dzieci, przyciągają was fałszywe światła i wielkie wynalazki, ale kiedy wszystko się zawali, rozczarowanie będzie ogromne, otwórzcie swoje serca i módlcie się. A teraz błogosławię was w imię Ojca i Syna i Ducha Świętego, Amen.","My children. thank you for answering my call in your hearts and for kneeling in prayer. My children, how much my heart aches for humanity that is in the balance. My children, you who are the awakened ones, awaken the consciences of your brothers and pray for your souls. Humanity has changed love to hate, prayer to blasphemy, the gift that God left for you (the Eucharist) is now something without meaning. Children, this is the time of grace and many will be the miracles that will happen, pray for God to have mercy. The great powers are attacking each other because of the proximity of so many demons, who are leading them to the great war. Italy will go hungry, but you, my children, be united always in the name of the Lord and trust only in Him, for only in Him will be the victory. Make cenacles of prayer also in your families, consecrate yourselves to my Immaculate Heart and I will protect you. My children, you are attracted by false lights and great inventions, but when everything collapses, the disappointment will be enormous, open your hearts and pray. Now I bless you in the name of the Father and the Son and the Holy Spirit, Amen.","Mis hijos. Gracias por responder mi llamada en tu corazón y por haber doblado las rodillas en oración. Mis hijos, cuánto sufre mi corazón por la humanidad que está en equilibrio. Niños, ustedes que son los despiertos, despiertan las conciencias de sus hermanos y rezan por sus almas. La humanidad ha cambiado el amor con el odio, la oración con blasfemia, el regalo que ha dejado a Dios por ti (la Eucaristía), ahora es algo sin sentido. Niños, este es el momento de la gracia y muchos serán los milagros que sucederán, rezan para que Dios tenga piedad. Las grandes potencias están atacando juntas debido a la proximidad de muchos demonios, que los están guiando a la Gran Guerra. Italia sufrirá de hambre, pero ustedes, mis hijos, siempre se unirán en nombre del Señor y confiarán solo en él, porque solo en él será la victoria. Haz cenacles de oración también en familias, consagrate a mi corazón inmaculado y te protegeré. Niños, se siente atraído por las falsas luces y grandes inventos, pero cuando todo se derrumbe, la decepción será enorme, abrirá el corazón y reza. Ahora los bendiga, en el nombre del Padre, del Hijo y el Espíritu Santo, Amén.","Mes enfants. Merci d'avoir répondu à mon appel dans vos cœurs et de s'agenouiller dans la prière. Mes enfants, combien mon cœur fait mal pour l'humanité qui est dans l'équilibre. Mes enfants, vous qui êtes éveillés, éveillez la conscience de vos frères et priez pour vos âmes. L'humanité a changé l'amour pour la haine, la prière en blasphème, le don que Dieu a laissé pour vous (l'Eucharistie) est maintenant quelque chose sans sens. Enfants, c'est le moment de la grâce et beaucoup seront les miracles qui se produiront, prieront pour que Dieu ait pitié. Les grands pouvoirs s'attaquent mutuellement à cause de la proximité de tant de démons, qui les mènent à la Grande Guerre. L'Italie aura faim, mais vous, mes enfants, serez toujours unis au nom du Seigneur et ne vous faites confiance qu'en lui, car seulement en lui sera la victoire. Faites également des cenacles de prière dans vos familles, consacrez-vous à mon cœur immaculé et je vous protégerai. Mes enfants, vous êtes attiré par de fausses lumières et de grandes inventions, mais quand tout s'effondrera, la déception sera énorme, ouvrez vos cœurs et priez. Maintenant, je vous bénis au nom du Père et du Fils et du Saint-Esprit, Amen.",我的孩子们。感谢您在心中回答我的电话，并跪在祈祷中。我的孩子们，我的心对人类的痛苦有多大。我的孩子，您是觉醒的人，唤醒了您兄弟的良心，并为您的灵魂祈祷。人类已经改变了爱的仇恨，向亵渎祈祷，上帝留给你的礼物（圣体圣事）现在没有意义。孩子们，这是恩典的时代，许多人将是将会发生的奇迹，祈求上帝怜悯。伟大的力量是因为如此众多的恶魔的接近，他们带领他们陷入了伟大的战争。意大利会饿，但是您，我的孩子们总是以主的名义团结起来，只有对他的信任，因为只有他才是胜利。在您的家人中也要祈祷，将自己奉献给我完美无缺的心，我将保护您。我的孩子们，您被虚假的灯光和出色的发明所吸引，但是当一切崩溃时，失望将是巨大的，敞开心hearts并祈祷。现在，我以父，儿子和圣灵的名义祝福你。,"Meine Kinder. Vielen Dank, dass Sie meinen Anruf in Ihren Herzen beantwortet und im Gebet knien. Meine Kinder, wie sehr mein Herz für die Menschheit schmerzt, die im Gleichgewicht ist. Meine Kinder, Sie, die die Erwachten sind, erweckten das Gewissen Ihrer Brüder und beten für Ihre Seelen. Die Menschheit hat die Liebe zu Hass verändert, das Gebet in Blasphemie, das Geschenk, das Gott für Sie (die Eucharistie) hinterlassen hat, ist jetzt etwas ohne Bedeutung. Kinder, dies ist die Zeit der Gnade und viele werden die Wunder sein, die passieren werden, beten, dass Gott Barmherzigkeit hat. Die Großmächte greifen sich aufgrund der Nähe von so vielen Dämonen an, die sie zum Ersten Weltkrieg führen. Italien wird hungrig werden, aber Sie, meine Kinder, werden immer im Namen des Herrn vereint und vertrauen nur in ihm, denn nur in ihm wird der Sieg sein. Machen Sie auch in Ihren Familien Cenakles des Gebets, weihen Sie sich meinem makellosen Herzen und ich werde Sie beschützen. Meine Kinder, Sie werden von falschen Lichtern und großen Erfindungen angezogen, aber wenn alles zusammenbricht, wird die Enttäuschung enorm sein, Ihre Herzen öffnen und beten. Jetzt segne ich dich im Namen des Vaters und des Sohnes und des Heiligen Geistes, Amen.","Minhas crianças. Obrigado por atender meu chamado em seus corações e por ajoelhar -se em oração. Meus filhos, quanto meu coração dói pela humanidade que está em equilíbrio. Meus filhos, vocês que são os despertados, despertam as consciências de seus irmãos e oram por suas almas. A humanidade mudou o amor ao ódio, a oração para a blasfêmia, o presente que Deus deixou para você (a Eucaristia) agora é algo sem significado. Filhos, este é o tempo da graça e muitos serão os milagres que acontecerão, orarão para que Deus tenha misericórdia. Os grandes poderes estão se atacando por causa da proximidade de tantos demônios, que os estão levando à Grande Guerra. A Itália passará fome, mas vocês, meus filhos, estarão sempre unidos em nome do Senhor e confiam apenas nele, pois apenas nele será a vitória. Faça cenáculos de oração também em suas famílias, consagram -se ao meu coração imaculado e eu o protegerei. Meus filhos, você é atraído por luzes falsas e ótimas invenções, mas quando tudo desmorona, a decepção será enorme, abrirá seus corações e orará. Agora eu te abençoo em nome do Pai, do Filho e do Espírito Santo, Amém."
