year,month,day,author,text_it,month_string,text_pl,text_en,text_es,text_fr,text_zh,text_de,text_pt
2022,9,3,Holy Mary,"Cari figli, grazie per aver risposto alla mia chiamata nel vostro cuore. Figli, piccoli bambini miei, la vostra fede mi commuove, perché conosco le vostre difficoltà, ma quando pregate e chiedete a mio Figlio Gesù, Lui fa scendere la provvidenza, ed eccovi qui in ginocchio a pregare con il Rosario tra le mani. Figli miei, questa terra sarà purificata con il fuoco, ma sarà anche benedetta dall’acqua che sgorgherà nei luoghi Mariani per la guarigione dell’anima e del corpo. Figli, pregate per la Russia e pregate affinché non venga toccato il nucleare. Pregate per la Chiesa che regna nella confusione. Oggi tra voi c’è una persona che vuole affacciarsi al sacerdozio, devi dire che Gesù ha bisogno di Santi sacerdoti. Gesù benedice questi nuovi sposi. Oggi, tante saranno le grazie che scenderanno su di voi. Figli, non perdete la strada della via, verità e vita.  Ora vi benedico nel nome della Santissima Trinità, amen.",September,"Drogie dzieci, dziękuję wam, że odpowiadacie na moje wezwanie w waszych sercach. Moje małe dzieci, wasza wiara porusza mnie, bo znam wasze trudności, ale kiedy modlicie się i prosicie mojego Syna Jezusa, On sprowadza opatrzność i oto jesteście na kolanach, modląc się z Różańcem w rękach. Moje dzieci, ta ziemia będzie oczyszczona przez ogień, ale będzie też błogosławiona przez wodę, która popłynie z miejsc maryjnych dla uzdrowienia duszy i ciała. Moje dzieci, módlcie się za Rosję i o to, by nie została użyta siła atomowa. Módlcie się za Kościół, który przoduje w zamęcie. Dzisiaj jest wśród was osoba, która chce wejść do kapłaństwa, trzeba powiedzieć, że Jezus potrzebuje świętych kapłanów. Jezus błogosławi tym nowym małżonkom. Dziś wiele łask zstąpi na Ciebie. Moje dzieci, nie zgubcie drogi do prawdy i życia. Teraz błogosławię was w imię Trójcy Świętej, Amen.","Dear children, thank you for responding to my call in your hearts. My little children, your faith moves me, for I know your difficulties, but when you pray and ask my Son Jesus, He brings providence down, and here you are on your knees praying with the Rosary in your hands. My children, this land will be purified by fire, but it will also be blessed by the water that will flow in Marian places for the healing of soul and body. My children, pray for Russia and pray that the nuclear power will not be touched. Pray for the Church that reigns in confusion. Today there is a person among you who wants to face the priesthood, you must say that Jesus needs holy priests. Jesus blesses these newlyweds. Today, many will be the graces that will descend upon you. Children, do not lose the way of the way, truth and life.  Now I bless you in the name of the Holy Trinity, Amen.","Queridos hijos, gracias por responder mi llamada en tu corazón. Niños, mis hijos, su fe me mueven, porque conozco sus dificultades, pero cuando ores y le preguntas a mi hijo Jesús, hace que la providencia descienda, y aquí está de rodillas rezar con el rosario en sus manos. Mis hijos, esta tierra será purificada con fuego, pero también será bendecida por el agua que fluirá en los lugares marianos para la curación del alma y el cuerpo. Niños, rezan por Rusia y rezan para que la energía nuclear no se toque. Ore por la iglesia que reine en confusión. Hoy hay una persona entre ustedes que quiere mirar el sacerdocio, debes decir que Jesús necesita santos sacerdotes. Jesús bendice a estos nuevos cónyuges. Hoy, habrá muchas gracias que te irán. Niños, no se pierdan el camino de la calle, la verdad y la vida. Ahora te bendiga en el nombre de la Santísima Trinidad, Amén.","Chers enfants, merci d'avoir répondu à mon appel dans votre cœur. Mes petits enfants, votre foi m'évalue, car je connais vos difficultés, mais quand vous priez et demandez à mon fils Jésus, il fait tomber Providence, et vous êtes à genoux en priant avec le chapelet dans vos mains. Mes enfants, cette terre sera purifiée par le feu, mais elle sera également bénie par l'eau qui coulera dans des endroits mariens pour la guérison de l'âme et du corps. Mes enfants, prient pour la Russie et prient pour que l'énergie nucléaire ne soit pas touchée. Priez pour l'église qui règne dans la confusion. Aujourd'hui, il y a une personne parmi vous qui veut faire face à la prêtrise, vous devez dire que Jésus a besoin de saints prêtres. Jésus bénit ces jeunes mariés. Aujourd'hui, beaucoup seront les grâces qui vous descendront sur vous. Enfants, ne perdez pas la voie de la voie, de la vérité et de la vie. Maintenant, je vous bénis au nom de la Sainte Trinité, Amen.",亲爱的孩子们，谢谢您回应我心中的电话。我的小孩子，你的信仰使我感动，因为我知道你的困难，但是当你祈祷并问我的儿子耶稣时，他把普罗维登斯倒下了，在这里，你跪在膝盖上，用念珠祈祷。我的孩子们，这片土地将被火净化，但也将由玛丽安（Marian）在灵魂和身体治愈的地方流淌的水来祝福。我的孩子们，为俄罗斯祈祷，并祈祷不会感动核电。为统治混乱的教会祈祷。今天，你们当中有一个想面对神职人员的人，您必须说耶稣需要圣洁的神父。耶稣祝福这些新婚夫妇。今天，许多人将成为您下降的恩典。孩子们，不要失去道路，真理和生活的方式。现在，我以圣三一的名义祝福你，阿们。,"Liebe Kinder, danke, dass Sie auf meinen Anruf in Ihrem Herzen geantwortet haben. Meine kleinen Kinder, dein Glaube bewegt mich, denn ich kenne deine Schwierigkeiten, aber wenn du betst und meinen Sohn Jesus fragst, bringt er die Vorsehung nach unten, und hier bist du auf deinen Knien und bete mit dem Rosenkranz in deinen Händen. Meine Kinder, dieses Land wird durch Feuer gereinigt, wird aber auch durch das Wasser gesegnet, das an marianischen Orten für die Heilung von Seele und Körper fließt. Meine Kinder beten für Russland und beten, dass die Atomkraft nicht berührt wird. Bete für die Kirche, die verwirrt regiert. Heute gibt es eine Person unter Ihnen, die sich dem Priestertum stellen will, Sie müssen sagen, dass Jesus heilige Priester braucht. Jesus segnet diese Jungvermählten. Heute werden viele die Gnaden sein, die auf Sie herabsteigen. Kinder, verlieren nicht den Weg des Weges, der Wahrheit und des Lebens. Jetzt segne ich dich im Namen der Heiligen Dreifaltigkeit, Amen.","Caros filhos, obrigado por responder à minha chamada em seus corações. Meus filhos pequenos, sua fé me move, pois conheço suas dificuldades, mas quando você ora e pergunta ao meu filho Jesus, ele derruba a Providência, e aqui está você de joelhos orando com o rosário em suas mãos. Meus filhos, esta terra será purificada pelo fogo, mas também será abençoada pela água que fluirá em lugares marianos para a cura da alma e do corpo. Meus filhos, oram pela Rússia e orem para que a energia nuclear não seja tocada. Ore pela igreja que reina em confusão. Hoje há uma pessoa entre vocês que quer enfrentar o sacerdócio, você deve dizer que Jesus precisa de santos sacerdotes. Jesus abençoa esses recém -casados. Hoje, muitos serão as graças que descerão sobre você. Crianças, não perdem o caminho do caminho, verdade e vida. Agora eu te abençoo em nome da Santíssima Trindade, Amém."
2022,9,6,Holy Mary,"Figli miei, grazie per aver risposto alla mia chiamata nel vostro cuore, dove sono gli altri miei figli! Pregate e digiunate, il mondo è l’involucro di tanti peccati iniziando dall’aborto, l’orgoglio, la superbia, nessun rispetto per il proprio corpo, tempio dello Spirito Santo, libidine sfrenata, guerra, conflitti e materialismo. I governanti sono presi dal male, i sacerdoti non hanno più rispetto per mio Figlio Gesù. Siete presi dalle cose del mondo e non vi curate della vostra anima. Io tocco la terra per avvertirvi, l’ira di Dio sarà grande, particolarmente per l’Italia e Roma, sede di Pietro. Figli miei, Io sono qui e allargo le mie braccia in attesa del pentimento e la conversione di questi figli, ai quali sarebbe perdonato tutto se tornassero a Dio. Figli adorati, ora vi benedico nel nome del Padre, del Figlio e dello Spirito Santo, amen.",September,"Moje dzieci, dziękuję wam za odpowiedź na moje wezwanie w waszych sercach, gdzie są moje inne dzieci! Módlcie się i pośćcie, świat jest otoczony skorupą wielu grzechów począwszy od aborcji, pychy, braku szacunku dla własnego ciała - świątyni Ducha Świętego, niepohamowanej żądzy, wojny, konfliktów i materializmu. Władcy uwikłani są w zło, kapłani nie mają już szacunku dla Mojego Syna Jezusa. Jesteście pochłonięci sprawami tego świata i nie dbacie o swoje dusze. Przychodzę na ziemię, aby was ostrzec, gniew Boga będzie wielki, szczególnie dla Włoch i Rzymu - Stolicy Piotrowej. Moje dzieci, jestem tu i wyciągam ręce oczekując skruchy i nawrócenia tych dzieci, którym wszystko byłoby wybaczone, gdyby powróciły do Boga. Umiłowane dzieci, błogosławię was teraz w imię Ojca i Syna i Ducha Świętego, Amen.","My children, thank you for answering my call in your heart, where are my other children! Pray and fast, the world is the shell of so many sins starting with abortion, pride, haughtiness, no respect for one's body - temple of the Holy Spirit, unbridled lust, war, conflicts and materialism. The rulers are caught up in evil, the priests no longer have respect for my Son Jesus. You are caught up in the things of the world and do not care for your soul. I touch the earth to warn you, the Wrath of God will be great, particularly for Italy and Rome, the See of Peter. My children, I am here and I extend My arms waiting for the repentance and conversion of these children, to whom all would be forgiven if they would return to God. Beloved children, I now bless you in the name of the Father and the Son and the Holy Spirit, Amen.","Mis hijos, gracias por responder mi llamada en su corazón, ¡dónde están mis otros hijos! Ore y rápido, el mundo es el sobre de muchos pecados que comienzan por el aborto, el orgullo, el orgullo, sin respeto por el cuerpo, el Templo del Espíritu Santo, la libido desenfrenada, la guerra, los conflictos y el materialismo. Los gobernantes son tomados por el mal, los sacerdotes ya no tienen respeto por mi hijo Jesús. Te toman las cosas del mundo y no te importa tu alma. Toco la tierra para advertirte, la ira de Dios será grande, particularmente para Italia y Roma, la sede de Pedro. Mis hijos, estoy aquí y ensancho mis brazos esperando el arrepentimiento y la conversión de estos hijos, a quienes todo habría sido perdonado si regresaran a Dios. Hijo y el Espíritu Santo, Amén.","Mes enfants, merci d'avoir répondu à mon appel dans votre cœur, où sont mes autres enfants! Priez et vite, le monde est la coquille de tant de péchés en commençant par l'avortement, la fierté, la hauteur, aucun respect pour son corps - le temple du Saint-Esprit, la luxure effrénée, la guerre, les conflits et le matérialisme. Les dirigeants sont pris dans le mal, les prêtres n'ont plus de respect pour mon fils Jésus. Vous êtes pris dans les choses du monde et ne vous souciez pas de votre âme. Je touche la terre pour vous avertir, la colère de Dieu sera grande, en particulier pour l'Italie et Rome, le siège de Pierre. Mes enfants, je suis ici et je prolonge mes bras en attendant le repentir et la conversion de ces enfants, à qui tous seraient pardonné s'ils retournaient à Dieu. Enfants bien-aimés, je vous bénis maintenant au nom du Père et du Fils et du Saint-Esprit, Amen.",我的孩子们，谢谢您在您的心中接我的电话，我的其他孩子在哪里！祈祷和迅速，世界是许多罪恶的外壳，从堕胎，骄傲，傲慢，不尊重自己的身体 - 圣灵的圣殿，无限的欲望，战争，冲突和唯物主义。统治者陷入了邪恶之中，祭司不再尊重我的儿子耶稣。您被世界的事物所困扰，不关心自己的灵魂。我触摸地球警告你，上帝的愤怒将是伟大的，尤其是对于意大利和罗马，彼得的见面。我的孩子们，我在这里，我伸出胳膊，等待着这些孩子的悔改和conversion依，如果他们回到上帝身上，他们都会被原谅。心爱的孩子，我现在以父，儿子和圣灵的名义祝福你。,"Meine Kinder, danke, dass du meinen Anruf in deinem Herzen beantwortet hast, wo sind meine anderen Kinder! Beten und schnell, die Welt ist die Hülle so vieler Sünden, beginnt mit Abtreibung, Stolz, Hochmut, ohne Respekt vor dem eigenen Körper - Tempel des Heiligen Geistes, ungezügelte Lust, Krieg, Konflikte und Materialismus. Die Herrscher sind in das Böse gefangen, die Priester haben keinen Respekt vor meinem Sohn Jesus. Sie sind in die Dinge der Welt gefangen und kümmern sich nicht um Ihre Seele. Ich berühre die Erde, um dich zu warnen, der Zorn Gottes wird großartig sein, besonders für Italien und Rom, das See von Peter. Meine Kinder, ich bin hier und ich strecke meine Arme aus und warte auf die Umkehr und Bekehrung dieser Kinder, denen alle vergeben werden würden, wenn sie zu Gott zurückkehren würden. Geliebte Kinder, ich segne dich jetzt im Namen des Vaters und des Sohnes und des Heiligen Geistes, Amen.","Meus filhos, obrigado por atender minha chamada em seu coração, onde estão meus outros filhos! Ore e rápido, o mundo é a concha de tantos pecados que começam com aborto, orgulho, arrogância, sem respeito pelo corpo de alguém - Templo do Espírito Santo, luxúria desenfreada, guerra, conflitos e materialismo. Os governantes estão envolvidos no mal, os sacerdotes não têm mais respeito pelo meu filho Jesus. Você está pego nas coisas do mundo e não se importa com sua alma. Eu toco a terra para avisá -lo, a ira de Deus será grande, principalmente para a Itália e Roma, a Sé de Pedro. Meus filhos, estou aqui e estendo meus braços esperando o arrependimento e a conversão dessas crianças, a quem todos seriam perdoados se retornassem a Deus. Filhos Amados, agora o abençoo em nome do Pai, do Filho e do Espírito Santo, Amém."
2022,9,12,Holy Mary,"Figlia mia, grazie per avermi accolta nella preghiera. Ormai sono giunti i tempi della battaglia, avete dato vita ad un’umanità senza Dio, avete permesso l’ingresso di un idolo al posto di Dio nella Chiesa e lo avete adorato al Suo posto. Figli miei, siate uniti nella vera dottrina della fede senza perdersi d’animo, aprite i vostri cuori allo Spirito Santo, siate costanti e siate guerrieri. Questo, per voi sarà causa di emarginazione e persecuzione, ma non abbiate paura, mio Figlio interverrà. Io vi sono vicina tutti i giorni e vi preserverò dai flagelli. Ora vi lascio con la mia benedizione materna nel nome del Padre, del Figlio e dello Spirito Santo, amen.",September,"Moje dziecko, dziękuję ci, że przyjęłaś mnie na modlitwie. Teraz nadszedł czas walki, zrodziliście bezbożną ludzkość, dopuściliście do Kościoła bożka w miejsce Boga i oddaliście mu cześć w Jego miejsce. Moje dzieci, bądźcie zjednoczeni w prawdziwej doktrynie wiary, nie tracąc serca, otwórzcie wasze serca na Ducha Świętego, bądźcie stali i wojowniczy. Będzie to dla was przyczyną marginalizacji i prześladowań, ale nie bójcie się, mój Syn będzie interweniował. Jestem blisko was każdego dnia i zachowam was od plag. A teraz zostawiam was z moim matczynym błogosławieństwem w imię Ojca i Syna i Ducha Świętego, Amen.","My daughter, thank you for accepting me in prayer. Now the time of battle has come, you have given birth to a godless humanity, you have allowed an idol to enter the Church instead of God and worshipped Him in His place. My children, be united in the true doctrine of the faith without losing heart, open your hearts to the Holy Spirit, be constant and be warriors. This, for you will cause marginalization and persecution, but do not be afraid, my Son will intervene. I am near you every day and will preserve you from the scourges. Now I leave you with my motherly blessing in the name of the Father and the Son and the Holy Spirit, Amen.","Mi hija, gracias por darme la bienvenida en oración. En este momento han llegado los tiempos de la batalla, has dado lugar a una humanidad sin Dios, permitiste la entrada de un ídolo en el lugar de Dios en la iglesia y lo amaste en su lugar. Mis hijos, se unan en la verdadera doctrina de la fe sin perderse, abre sus corazones al Espíritu Santo, sean constantes y sean guerreros. Esto, para usted será la causa de la marginación y la persecución, pero no tenga miedo, mi hijo intervenirá. Estoy cerca de ti todos los días y te conservaré de los Flagelli. Ahora te dejo con mi bendición materna en el nombre del Padre, el Hijo y el Espíritu Santo, Amén.","Ma fille, merci de m'avoir accepté dans la prière. Maintenant que le temps de la bataille est venu, vous avez donné naissance à une humanité impie, vous avez permis à une idole d'entrer dans l'Église au lieu de Dieu et de l'adorer à sa place. Mes enfants, soyez unis dans la vraie doctrine de la foi sans perdre le cœur, ouvrez votre cœur au Saint-Esprit, soyez constant et soyez des guerriers. Ceci, car vous provoquera une marginalisation et une persécution, mais n'ayez pas peur, mon fils interviendra. Je suis près de chez vous tous les jours et vous préserverai des fléaux. Maintenant, je vous laisse avec ma bénédiction maternelle au nom du Père et du Fils et du Saint-Esprit, Amen.",我的女儿，谢谢您接受我的祈祷。现在战斗的时间已经到来，您已经诞生了无神的人类，您允许偶像进入教会，而不是上帝，并用他的代理敬拜他。我的孩子们，在信仰的真实教义中团结起来而不会失去心，向圣灵敞开心hearts，保持恒定并成为战士。这是因为您会造成边缘化和迫害，但不要害怕，我儿子会干预。我每天都在您附近，并将您免受祸害。现在，我以父亲，儿子和圣灵的名义给我的母亲祝福。,"Meine Tochter, danke, dass du mich im Gebet angenommen hast. Jetzt ist die Zeit des Kampfes gekommen, Sie haben eine gottlose Menschheit zur Welt gebracht, Sie haben ein Idol erlaubt, die Kirche anstelle von Gott zu betreten und ihn an seiner Stelle anzubeten. Meine Kinder, werden in der wahren Lehre des Glaubens vereint, ohne das Herz zu verlieren, öffnen Sie Ihren Herzen für den Heiligen Geist, seien Sie konstant und Krieger. Dies, denn Sie werden Marginalisierung und Verfolgung verursachen, aber ich habe keine Angst, mein Sohn wird eingreifen. Ich bin jeden Tag in Ihrer Nähe und werde Sie vor den Geißeln bewahren. Jetzt verlasse ich dich mit meinem mütterlichen Segen im Namen des Vaters und des Sohnes und des Heiligen Geistes Amen.","Minha filha, obrigado por me aceitar em oração. Agora que chegou o momento da batalha, você deu à luz uma humanidade sem Deus, permitiu que um ídolo entrasse na igreja em vez de Deus e o adorou em seu lugar. Meus filhos, unidos na verdadeira doutrina da fé sem perder o coração, abrem seus corações para o Espírito Santo, sejam constantes e sejam guerreiros. Isso, pois você causará marginalização e perseguição, mas não tem medo, meu filho intervirá. Estou perto de você todos os dias e vou preservá -lo dos flagelos. Agora deixo você com minha bênção materna em nome do Pai, do Filho e do Espírito Santo, Amém."
2022,9,13,Jesus Christ,"Figli e fratelli miei, grazie per essere qui e per aver piegato le vostre ginocchia sotto la mia croce. Figli miei, Io tocco questa collina benedetta e questa terra, affinché le grazie siano tante. Fratelli miei, vi guardo tutti i giorni e quanto sono felice, quando vedo molti di voi che evitano il peccato e quando avete lo sguardo rivolto verso la luce. Ascoltate ciò che dice la mia e vostra Santissima Madre, non temete per i tempi di dolore che vi attendono perché quando verrete qui, potrete gioire della felicità pura, tutto è pronto. Ora vi benedico, nel nome del Padre, nel Mio nome e dello Spirito Santo. Io sarò con voi per tutta la preghiera, alzate i vostri rosari e avvicinatevi ai piedi della Croce ed Io li benedirò. Il vostro caro Gesù.",September,"Moi synowie i bracia, dziękuję wam, że jesteście tutaj i klękacie pod moim krzyżem. Moje dzieci, dotykam tego błogosławionego wzgórza i tej ziemi, aby łaski były liczne. Bracia moi, patrzę na was każdego dnia i jakże się cieszę, gdy widzę, że wielu z was unika grzechu i gdy macie oczy zwrócone ku światłu. Słuchajcie tego, co mówi moja i wasza najświętsza Matka, nie lękajcie się o czasy smutku, które was czekają, bo kiedy przyjdziecie tutaj, będziecie mogli cieszyć się czystym szczęściem, wszystko jest gotowe. Teraz błogosławię was, w imię Ojca, w imię Moje i Ducha Świętego. Będę z wami podczas całej modlitwy, podnieście swoje różańce i podejdźcie do stóp Krzyża, a Ja wam pobłogosławię. Wasz kochany Jezus.","My children and brothers, thank you for being here and for bending your knees under My cross. My children, I touch this blessed hill and this land so that graces may be many. My brothers, I look at you every day and how happy I am when I see many of you avoiding sin and when you have your eyes turned toward the light. Listen to what my and your Blessed Mother says, do not fear for the times of sorrow that await you because when you come here, you can rejoice in pure happiness, everything is ready. Now I bless you, in the name of the Father, in My name and the Holy Spirit. I will be with you throughout the prayer, raise your rosaries and approach the foot of the Cross and I will bless them. Your dear Jesus.","Mis hijos y hermanos, gracias por estar aquí y por haber doblado las rodillas debajo de mi cruz. Mis hijos, toco esta bendita colina y esta tierra, para que las gracias sean muchas. Mis hermanos, te miro todos los días y lo feliz que estoy, cuando veo a muchos de ustedes que evitan el pecado y cuando miran hacia la luz. Escuche lo que dice mi y la santa madre, no teman por los tiempos de dolor que le esperan porque cuando vienes aquí, puedes regocijarte en pura felicidad, todo está listo. Ahora te bendiga, en el nombre del Padre, en mi nombre y el Espíritu Santo. Estaré contigo durante toda la oración, levantaré tus rosarios y me acertaré al pie de la cruz y los bendeciré. Tu querido Jesús.","Mes enfants et mes frères, merci d'être ici et d'avoir plié vos genoux sous ma croix. Mes enfants, je touche à cette colline bénie et à cette terre pour que les grâces puissent être nombreuses. Mes frères, je vous regarde tous les jours et à quel point je suis heureux quand je vois beaucoup d'entre vous éviter le péché et quand vous avez les yeux tournés vers la lumière. Écoutez ce que dit ma mère et votre Sainte Mère, ne craignez pas les temps de chagrin qui vous attendent parce que lorsque vous venez ici, vous pouvez vous réjouir d'un pur bonheur, tout est prêt. Maintenant, je vous bénis, au nom du Père, en mon nom et au Saint-Esprit. Je serai avec vous tout au long de la prière, élèverai vos chapelets et approcherai du pied de la croix et je les bénirai. Votre cher Jésus.",我的孩子和兄弟，感谢您在这里并在我的十字架下弯腰。我的孩子们，我触摸了这座有福的山丘和这片土地，使恩典可能很多。我的兄弟们，我每天都看着你，当我看到你们中的许多人避免犯罪以及您的眼睛转向光线时，我有多快乐。听我和你的幸福母亲所说的话，不要担心等待着你的悲伤时代，因为当你来到这里时，你可以为纯洁的幸福而欢欣鼓舞，一切都准备好了。现在，我以父亲的名义，以我的名义和圣灵祝福你。在整个祈祷期间，我将与您同在，举起念珠，接近十字架的脚，我会祝福他们。你亲爱的耶稣。,"Meine Kinder und Brüder, danke, dass Sie hier sind und sich die Knie unter meinem Kreuz beugen. Meine Kinder, ich berühre diesen gesegneten Hügel und dieses Land, damit Gnaden viele sein können. Meine Brüder, ich sehe dich jeden Tag an und wie glücklich ich bin, wenn ich sehe, dass viele von Ihnen die Sünde vermeiden und wenn Sie Ihre Augen zum Licht zugewandt haben. Hören Sie, was meine und Ihre gesegnete Mutter sagt, für die Zeit der Trauer, die Sie erwarten, nicht fürchten, denn wenn Sie hierher kommen, können Sie sich über das reine Glück freuen, alles ist fertig. Jetzt segne ich dich im Namen des Vaters in meinem Namen und dem Heiligen Geist. Ich werde während des gesamten Gebets bei Ihnen sein, Ihre Rosenkränze erhöhen und sich dem Fuß des Kreuzes nähern, und ich werde sie segnen. Dein lieber Jesus.","Meus filhos e irmãos, obrigado por estar aqui e por dobrar os joelhos sob minha cruz. Meus filhos, eu toco essa colina abençoada e esta terra para que as graças possam ser muitas. Meus irmãos, olho para você todos os dias e como estou feliz quando vejo muitos de vocês evitando o pecado e quando você tem os olhos se virando para a luz. Ouça o que minha mãe e sua mãe abençoada diz, não tema pelos tempos de tristeza que o esperam porque, quando você vier aqui, você pode se alegrar com a pura felicidade, tudo está pronto. Agora eu te abençoo, em nome do Pai, em meu nome e no Espírito Santo. Estarei com você durante toda a oração, levantarei seus rosários e abordarei o pé da cruz e eu os abençoarei. Seu querido Jesus."
