year,month,day,author,text,text_en,text_pl,month_string
2019,10,01,Holy Mary,"Cari figli miei, grazie per aver risposto alla mia chiamata nel vostro cuore. Amati figli, vorrei istruirvi per cosa chiedere e come pregare il Signore Gesù Cristo; Figli, aprite i vostri cuori nella preghiera. Chiedete a Dio di essere immersi nella sua luce, affinché possiate testimoniare con coraggio e parlare di Gesù senza aver paura: chiedete il dono della conoscenza, dell'umiltà e della fratellanza. Quando tutto ciò avverrà, il Vostro Sì sarà sincero: avrete tutto ciò di cui avrete bisogno, le grazie scenderanno su di voi e sentirete nel cuore la gioia e la pace. Andate alla messa perché Lui Vi attende. Urlate al mondo che mio Figlio presto sarà con voi. Che la benedizione del Padre, del Figlio e dello Spirito Santo discenda su di voi e sulle vostre famiglie, Amen”.","My dear children, thank you for having responded to my call in your heart. Beloved children, I would like to instruct you what to ask for and how to pray to the Lord Jesus Christ; Children, open your hearts in prayer. Ask God to be immersed in his light, so that you can bear witness with courage and speak of Jesus without fear: ask for the gift of knowledge, humility and brotherhood. When all this happens, your Yes will be sincere: you will have everything you need, the graces will descend on you and you will feel joy and peace in your heart. Go to mass because He is waiting for you. Scream to the world that my Son will soon be with you. May the blessing of the Father, the Son and the Holy Spirit descend upon you and your families, Amen ”. ","Moje drogie dzieci, dziękuję, że odpowiedzieliście na moje wezwanie w waszych sercach. Umiłowane dzieci, chciałabym wam wskazać, o co prosić i jak się modlić do Pana Jezusa Chrystusa; Dzieci, otwórzcie swoje serca na modlitwie. Proś Boga, abyś mógł być zanurzony w Jego świetle, abyś mógł odważnie dawać świadectwo i mówić o Jezusie bez lęku: proś o dar poznania, pokory i braterstwa. Kiedy to wszystko się wydarzy, twoje tak będzie szczere: będziesz miał wszystko, czego potrzebujesz, łaski zstąpią na ciebie i poczujesz radość i pokój w swoim sercu. Idź na mszę, bo On na ciebie czeka. Krzyczcie światu, że mój Syn wkrótce będzie z wami. Niech błogosławieństwo Ojca, Syna i Ducha Świętego zstąpi na was i na wasze rodziny, Amen ",October
2019,10,03,Holy Mary,"Amati figli miei, grazie per aver risposto alla mia chiamata nel vostro cuore. Oggi, voglio portare la pace nei vostri cuori, affinché si possano aprire alla grazia. Figli, i tempi sono molto duri, ma io sono qui e non vi lascio soli, ma soltanto se voi lo volete davvero. Figli, pregate per la Chiesa, il mondo sì è perso tra le grinfie di Satana, ma la nostra preghiera e il Rosario sarà una grande protezione per voi e per le vostre famiglie. Pastori, evangelizzate, portate la parola di Dio nelle case, ai giovani insegnate l'amore, ecco questa è la Chiesa, la famiglia, la prima piccola chiesa, non abbiate paura di essere giudicati, ma andate avanti con la benedizione di Dio. Ora vi benedico nel nome del Padre, del Figlio dello Spirito Santo, Sarò con voi fino alla fine della preghiera per benedire voi e gli oggetti sacri che indossate, oggi figli scenderanno molte grazie, Amen”.","My beloved children, thank you for having responded to my call in your heart. Today, I want to bring peace into your hearts, so that they can open up to grace. Children, times are very hard, but I am here and I will not leave you alone, but only if you really want it. Children, pray for the Church, the world is lost in the clutches of Satan, but our prayer and the Rosary will be a great protection for you and for your families. Pastors, evangelize, bring the word of God into homes, teach young people about love, this is the Church, the family, the first little church, do not be afraid of being judged, but go ahead with God's blessing. Now I bless you in the name of the Father, of the Son of the Holy Spirit, I will be with you until the end of the prayer to bless you and the sacred objects you wear, today children many graces will come down, Amen ”. ","Moje ukochane dzieci, dziękuję, że odpowiedzieliście na moje wezwanie w waszych sercach. Dziś chcę wnieść pokój do waszych serc, aby otworzyły się na łaskę. Dzieci, czasy są bardzo ciężkie, ale jestem tutaj i nie zostawię was samych, ale tylko wtedy, gdy naprawdę tego chcecie. Dzieci, módlcie się za Kościół, świat zagubiony jest w szponach szatana, ale nasza modlitwa i różaniec będą wielką ochroną dla was i dla waszych rodzin. Pasterze ewangelizują, przynoszą słowo Boże do domów, uczą młodych ludzi o miłości, to jest Kościół, rodzina, pierwszy mały kościół, nie bójcie się osądzania, ale idźcie naprzód z Bożym błogosławieństwem. Błogosławię was w imię Ojca, Syna Ducha Świętego, będę z wami do końca modlitwy, aby was błogosławić i święte przedmioty, które nosicie, dzisiaj dzieci wiele łask spadnie, Amen ",October
2019,10,05,Holy Mary,"Figli amati, grazie per essere qui nella preghiera e per aver risposto alla mia chiamata nel vostro cuore. Amati miei, pregate, pregate, pregate molto, affinché la fede possa tornare in questo mondo imbestialito. Figli, parte degli uomini di chiesa hanno perso la fede. Pregate tanto, ora vi benedico nel nome del Padre, del Figlio e dello Spirito Santo, Amen”.","Beloved children, thank you for being here in prayer and for having responded to my call in your heart. My beloved, pray, pray, pray a lot, so that faith can return to this furious world. Children, some of the churchmen have lost their faith. Pray a lot, now I bless you in the name of the Father, of the Son and of the Holy Spirit, Amen ”. ","Umiłowane dzieci, dziękuję wam, że jesteście tu na modlitwie i odpowiedzieliście na moje wezwanie w waszych sercach. Moi umiłowani, módlcie się, módlcie się, módlcie się dużo, aby wiara mogła powrócić do tego wściekłego świata. Dzieci, niektórzy duchowni stracili wiarę. Módlcie się dużo, teraz błogosławię was w imię Ojca, Syna i Ducha Świętego, Amen ",October
2019,10,07,Holy Mary,"Amati figli miei, grazie per essere riuniti qui nella preghiera con fede. In questo momento serve solo la preghiera, dove sono i miei figli! Grande è la mia sofferenza, perché mio Figlio Gesù è stato messo da parte, il nostro Dio misericordioso sta per essere sostituito, quante lacrime ho versato!!, anche di sangue, per farvi capire il mio dolore e sconforto, perché poca è la fede in questa terra!! Figli portate i miei messaggi nel mondo, raccogliete anime da portare a Gesù, non siate silenziosi, ma guerrieri di Luce, dite al mondo di convertirsi e di amare solo il nostro Dio, Unico e Trino. Ora, vi lascio con la mia santa benedizione, nel nome del Padre, del Figlio e dello Spirito Santo, Amen”.","My beloved children, thank you for being gathered here in prayer with faith. At this moment all we need is prayer, where are my children! Great is my suffering, because my Son Jesus has been set aside, our merciful God is about to be replaced, how many tears have I shed !!, even of blood, to make you understand my pain and despair, because faith is little in this land !! Children, bring my messages into the world, gather souls to bring to Jesus, do not be silent, but warriors of Light, tell the world to convert and to love only our God, One and Triune. Now, I leave you with my holy blessing, in the name of the Father, the Son and the Holy Spirit, Amen ”. ","Moje ukochane dzieci, dziękuję wam, że jesteście tu zgromadzeni na modlitwie z wiarą. W tej chwili potrzebujemy tylko modlitwy, gdzie są moje dzieci! Wielkie jest moje cierpienie, ponieważ mój Syn Jezus został odsunięty na bok, nasz miłosierny Bóg ma zostać zastąpiony, ileż łez przelałam !, nawet krwi, abyście zrozumieli mój ból i rozpacz, ponieważ wiara jest mała na tej ziemi !! Dzieci, przynieście moje przesłania światu, zbierzcie dusze, aby przynieśli je Jezusowi, nie milczcie, ale wojownicy Światła, powiedzcie światu, aby nawrócił się i kochał tylko naszego Boga, Jedynego i Trójjedynego. Teraz zostawiam was z moim świętym błogosławieństwem, w imię Ojca, Syna i Ducha Świętego, Amen ",October
2019,10,12,Holy Mary,"Figli miei amati, grazie per aver risposto alla mia chiamata nel vostro cuore. Io vedo i miei figli uniti e il mio cuore si rallegra. Figli miei, vi invito all’amore che vi ha sempre uniti e alla preghiera, ricordate i miei messaggi? Li avete vissuti completAmente? Non dimenticate che il demonio è molto forte in questi tempi, vi tenta e vi costringe alla disunione, vi crea dubbi su tutto, soprattutto capovolgendo la verità. Vi amo, sono vostra Madre, scesa dal cielo per proteggervi, vivete la grazia che Dio ha permesso di inviarvi e siate testimoni coraggiosi sempre. Figli, io sono qui, non abbiate paura, insieme a mio Figlio vi proteggeremo sempre, non permettete alla grande confusione generata in questi tempi di entrare nelle vostre vite, ma siate fedeli alla Parola, il Vangelo. Ora vi benedico nel nome del Padre, del Figlio e dello Spirito Santo, Amen”.","My beloved children, thank you for having responded to my call in your heart. I see my children united and my heart rejoices. My children, I invite you to the love that has always united you and to prayer, do you remember my messages? Have you lived them completely? Do not forget that the devil is very strong in these times, he tempts you and forces you to disunion, he creates doubts about everything, above all by overturning the truth. I love you, I am your Mother, who came down from heaven to protect you, live the grace that God has allowed to send you and always be courageous witnesses. Children, I am here, do not be afraid, together with my Son we will always protect you, do not allow the great confusion generated in these times to enter your lives, but be faithful to the Word, the Gospel. Now I bless you in the name of the Father, the Son and the Holy Spirit, Amen ”. ","Moje ukochane dzieci, dziękuję, że odpowiedzieliście na moje wezwanie w waszych sercach. Widzę zjednoczone dzieci i raduje się moje serce. Moje dzieci, zapraszam was do miłości, która zawsze was łączyła i do modlitwy, czy pamiętacie moje orędzia? Czy przeżyłeś je całkowicie? Nie zapominajmy, że diabeł jest w tych czasach bardzo silny, kusi i zmusza do rozłamu, stwarza wątpliwości we wszystkim, przede wszystkim obalając prawdę. Kocham Cię, jestem Twoją Matką, która zstąpiła z Nieba, aby Cię chronić, żyj łaską, którą Bóg pozwolił Ci zesłać, i zawsze bądź odważnym świadkiem. Dzieci, jestem tutaj, nie bójcie się, razem z moim Synem zawsze będziemy was chronić, nie pozwólcie, aby wielkie zamieszanie, jakie powstało w tych czasach, wkroczyło w wasze życie, ale bądźcie wierni Słowu, Ewangelii. Teraz błogosławię was w imię Ojca, Syna i Ducha Świętego, Amen ",October
2019,10,15,Holy Mary,"Amati miei bambini, grazie per aver risposto alla mia chiamata nel vostro cuore. Figli miei, quanto è grande il dolore e la sofferenza che provo ogni volta che i miei prescelti vengono derisi, giudicati e guardati come appestati, tutto si sta compiendo. Mio figlio sta per essere messo fuori dalla chiesa, coloro che fanno questo, continuano a far sanguinare ancora di più le ferite di Gesù e non credono che presto la giustizia sì abbatterà su di loro. Ecco la parola di Dio si compirà. Figli miei, ricordate che la Parola e il Vangelo sono immutabili. Dopo il grande dolore la mia Chiesa risorgerà con pochi fedeli, ma veri. Ora vi benedico nel nome del Padre, del Figlio e dello Spirito Santo, Amen”.","My beloved children, thank you for having responded to my call in your heart. My children, how great is the pain and suffering that I feel every time my chosen ones are derided, judged and looked at as plague, everything is taking place. My son is about to be put out of the church, those who do this continue to make Jesus' wounds bleed even more and do not believe that justice will soon befall them. Here is the word of God will be fulfilled. My children, remember that the Word and the Gospel are immutable. After the great pain my Church will rise again with few faithful, but true ones. Now I bless you in the name of the Father, the Son and the Holy Spirit, Amen ”. ","Moje ukochane dzieci, dziękuję, że odpowiedzieliście na moje wezwanie w waszych sercach. Moje dzieci, jak wielki jest ból i cierpienie, które odczuwam za każdym razem, gdy moi wybrani są wyśmiewani, osądzani i postrzegani jako wszystko to się dzieje teraz. Mój syn ma zostać wyrzucony z kościoła, ci, którzy to robią, nadal sprawiają, że rany Jezusa krwawią jeszcze bardziej i nie wierzą, że wkrótce spotka ich sprawiedliwość. Oto słowo Boże się spełni. Moje dzieci, pamiętajcie, że Słowo i Ewangelia są niezmienne. Po wielkim bólu mój Kościół zmartwychwstanie z kilkoma wiernymi, ale prawdziwymi. Teraz błogosławię was w imię Ojca, Syna i Ducha Świętego, Amen ",October
2019,10,19,Jesus Christ,"Fratelli miei, io sono qui con voi, quanto siete piccoli, siete ancora bambini, io vi voglio grandi nella fede con i vostri cuori da bambini. Oh! Fratelli miei, vi chiedo di non vacillare con la fede, o darete spazio a satana. Non bisogna cambiare casa e spostarsi qualunque cosa accada, ma siate uniti, i miei angeli vi proteggeranno, presto la mano di Dio sarà sul mondo, quante cose stanno sta accadendo sulla terra, Oh! la mia chiesa, la mia chiesa mi ha voltato le spalle, ma io rinascerò, tornerò. Mia Madre! quanto è grande il suo dolore, ma voi datele amore, solo amore, quello che noi chiediamo è solo amore. Dio è buono e paziente, Lui vi perdonerà da tutti i vostri peccati, se sincerAmente vi pentirete. Oh! Bambini miei, fratelli miei, quanto vi amo., i miei angeli vi proteggono dagli attacchi della terra, state sereni e fidatevi di me, io non vi lascerò mai soli, conosco i vostri cuori e so quanto è grande il vostro amore per me, per mia Madre e mio Padre. State ancorati alla fede, è l’unica vostra salvezza insieme alla preghiera. Fratelli cari, io vi amo e vi sono accanto oggi e sempre. Ora, vi benedico tutti, nel nome del Padre, nel mio nome e dello Spirito santo, Amen”.","My brothers, I am here with you, how small you are, you are still children, I want you great in faith with your hearts as children. Oh! My brothers, I ask you not to waver with faith, or you will make room for satan. There is no need to move house and move no matter what happens, but be united, my angels will protect you, soon God's hand will be on the world, how many things are happening on earth, Oh! my church, my church has turned its back on me, but I'll be reborn, I'll be back. My mother! how great is her pain, but you give her love, only love, what we ask is only love. God is good and patient, He will forgive you of all your sins if you sincerely repent. Oh! My children, my brothers, how much I love you., My angels protect you from the attacks of the earth, be calm and trust me, I will never leave you alone, I know your hearts and I know how great your love is for me, for my Mother and my Father. Be anchored in faith, it is your only salvation together with prayer. Dear brothers, I love you and I am with you today and always. Now, I bless you all, in the name of the Father, in my name and in the Holy Spirit, Amen ”. ","Moi bracia, jestem tu z wami, jacy jesteście mali, wciąż jesteście dziećmi, pragnę, abyście byli wielcy w wierze w waszych sercach jak dzieci. O! Moi bracia, proszę was, nie wahajcie się z wiarą, bo inaczej zrobicie miejsce dla szatana. Nie ma potrzeby opuszczenia domu i przeniesienia się, cokolwiek się stanie, ale bądźcie zjednoczeni, moi aniołowie będą was chronić, wkrótce ręka Boża będzie na świecie, ile rzeczy dzieje się na ziemi, Och! mój kościół, mój kościół odwrócił się ode mnie, ale ja się odrodzę, wrócę. Moja matka! jak wielki jest jej ból, ale ty dajesz jej miłość, tylko miłość, o co prosimy, to tylko miłość. Bóg jest dobry i cierpliwy, przebaczy ci wszystkie twoje grzechy, jeśli szczerze pokutujesz. O! Moje dzieci, moi bracia, jak bardzo was kocham. Moi aniołowie chronią was przed atakami ziemi, bądźcie spokojni i zaufajcie mi, nigdy was nie zostawię samych, znam wasze serca i wiem, jak wielka jest wasza miłość do mnie, dla mojej Matki i Ojca. Bądźcie zakotwiczeni w wierze, to jest wasze jedyne zbawienie wraz z modlitwą. Drodzy bracia, kocham was i jestem z wami dzisiaj i zawsze. Teraz wszystkich was błogosławię w imię Ojca, w imię moje i Ducha Świętego, Amen ",October
2019,10,23,Holy Mary,"Figlia mia, grazie per le tue preghiere, non agitarti per le cose del mondo, ma continua nella preghiera. Urla al mondo che chi sarà fedele a Dio, presto sentirà gioia, spensieratezza, amore, ma chi si volterà dall'altra parte adorando dei o altro, questi sentiranno incupire il loro cuore e sentiranno disperazione, sconforto e tristezza. Il ritorno del Figlio di Dio è prossimo, gioite e annunciate la nuova Gerusalemme. Figlia mia, quanto dolore sento, per non aver esaudito la mia richiesta di consacrazione, ricorda a chi non vuole ascoltarmi, che la fede è anche coraggio e testimonianza, Dio vomita i tiepidi. Ora ti lascio con la mia benedizione materna, nel nome del Padre e del Figlio e dello Spirito Santo, Amen”.","My daughter, thank you for your prayers, do not be agitated by the things of the world, but continue in prayer. Scream to the world that whoever is faithful to God will soon feel joy, carefree, love, but whoever turns the other way adoring gods or other, they will feel their hearts darken and feel despair, despair and sadness. The return of the Son of God is near, rejoice and announce the new Jerusalem. My daughter, how much pain I feel for not having fulfilled my request for consecration, remind those who do not want to listen to me, that faith is also courage and witness, God vomits the lukewarm. Now I leave you with my maternal blessing, in the name of the Father and of the Son and of the Holy Spirit, Amen ”. ","Moja córko, dziękuję ci za modlitwy, nie przejmuj się sprawami tego świata, ale trwaj w modlitwie. Krzycz światu, że ktokolwiek jest wierny Bogu, wkrótce poczuje radość, beztroskę, miłość, ale kto odwróci się, oddając cześć bogom lub innym, poczuje, że jego serca ciemnieją i odczują rozpacz, bezradność i smutek. Powrót Syna Bożego jest bliski, radujcie się i ogłaszajcie nowe Jeruzalem. Moja córko, ile bólu odczuwam, że nie spełniłam mojej prośby o konsekrację, przypomnij tym, którzy nie chcą Mnie słuchać, że wiara to także odwaga i świadectwo, Bóg wypluwa letnich. Teraz zostawiam was z moim macierzyńskim błogosławieństwem w imię Ojca i Syna i Ducha Świętego, Amen ",October
2019,10,26,Holy Mary,"Figli miei amati, grazie per aver risposto alla mia chiamata nel vostro cuore. Figli miei, quanta pace sento nei vostri cuori nonostante i momenti tristi, ma vi prego, rafforzate la vostra fede e la preghiera, chiedo cenacoli nelle vostre case. In questo momento i miei angeli lottano contro gli angeli del male, l’apostasia continua ad aleggiare nella chiesa, ma solo con la preghiera tutto potrà tornare come Gesù l’ha voluta. Figli, tante saranno le Grazie che scenderanno per chi avrà fede, il mio Cuore Immacolato Trionferà presto. Ora vi benedico nel nome del Padre, del Figlio e dello Spirito Santo, Amen”.","My beloved children, thank you for having responded to my call in your heart. My children, how much peace I feel in your hearts despite the sad moments, but please, strengthen your faith and prayer, I ask for cenacles in your homes. At this moment my angels are fighting against the angels of evil, apostasy continues to hover in the church, but only with prayer can everything return to the way Jesus wanted it. Children, so many will be the Graces that will descend for those who have faith, my Immaculate Heart will soon Triumph. Now I bless you in the name of the Father, the Son and the Holy Spirit, Amen ”. ","Moje ukochane dzieci, dziękuję, że odpowiedzieliście na moje wezwanie w waszych sercach. Moje dzieci, ile spokoju czuję w waszych sercach pomimo smutnych chwil, ale proszę, wzmocnijcie wiarę i modlitwę, proszę o wieczerniki w waszych domach. W tej chwili moi aniołowie walczą z aniołami zła, apostazja nadal trwa w kościele, ale tylko dzięki modlitwie wszystko może powrócić zgodnie z zamierzeniami Jezusa. Dzieci, tak wiele będzie Łask, które zstąpią na tych, którzy wierzą, moje Niepokalane Serce wkrótce zatriumfuje. Teraz błogosławię was w imię Ojca, Syna i Ducha Świętego, Amen ",October
2019,10,30,Holy Mary,"Figlia mia, grazie per essere presente nella preghiera, tanti saranno i dolori che arriveranno, ma non affaticarti, rifugiati nel mio Cuore Immacolato e lì troverai conforto. Figlia mia, la persecuzione dei Cristiani a breve avrà inizio, quindi fate tutti molto attenzione, prendete i miei consigli da Madre e non giratevi dall'altra parte. Abbiate pazienza, amore e carità per i vostri fratelli perché arriveranno momenti bui in cui non vi troverete. L’America patirà il dolore più grande a causa delle leggi contro Dio. Siate sempre fedeli al vero magistero della Chiesa, Dio è l'unico a cui dovete affidarvi, state lontani dalle false ideologie moderniste, altrimenti sarete ciechi che guidano altri ciechi. Vi amo e con Amore Materno vi benedico nel nome del Padre, del Figlio e dello Spirito Santo, Amen”.","My daughter, thank you for being present in prayer, so many will be the pains that will come, but do not tire yourself, take refuge in my Immaculate Heart and there you will find comfort. My daughter, the persecution of Christians will begin shortly, so be very careful, take my advice from Mother and do not turn away. Have patience, love and charity for your brothers because dark moments will come when you will not find yourselves. America will suffer the greatest pain due to the laws against God. Always be faithful to the true magisterium of the Church, God is the only one you must rely on, stay away from false modernist ideologies, otherwise you will be blind leading other blind people. I love you and with Maternal Love I bless you in the name of the Father, of the Son and of the Holy Spirit, Amen ”. ","Moja córko, dziękuję ci, że jesteś obecna na modlitwie, wiele będzie boleści, które nadejdą, ale nie męcz się, uciekaj do mojego Niepokalanego Serca, a tam znajdziesz pocieszenie. Moja córko, niedługo zaczną się prześladowania chrześcijan, więc bądź bardzo ostrożna, posłuchaj mojej rady Matki i nie odwracaj się. Miejcie cierpliwość, miłość i miłosierdzie dla swoich braci, ponieważ nadejdą mroczne chwile, w których nie będziecie mogli się odnaleźć. Ameryka będzie cierpieć największy ból z powodu praw przeciwko Bogu.Zawsze bądź wierny prawdziwemu Magisterium Kościoła, Bóg jest jedynym, któremu możesz zaufać, trzymaj się z dala od fałszywych ideologii modernistycznych, w przeciwnym razie będziesz ślepy prowadząc innych niewidomych ludzi. Kocham was i z miłością macierzyńską błogosławię was w imię Ojca, Syna i Ducha Świętego, Amen ",October
2019,10,31,Holy Mary,"Figli miei amati, grazie per essere qui nella preghiera, oh! quanto alleggerite il mio dolore e quello di mio Figlio! Amati miei, ma cosa sta facendo l’umanità, sta accogliendo, esaltando e proclamando il peccato come un qualcosa di gradito a Dio, ma non è cosi, per questi si apriranno le porte degli inferi. Figli miei, venite spesso a trovarmi in questo luogo benedetto dal Padre. Ora vi benedico nel nome del Padre, del Figlio e dello Spirito Santo, Amen”.    Regina del Rosario","My beloved children, thank you for being here in prayer, oh! how much you lighten my pain and that of my Son! My beloved, but what humanity is doing, it is welcoming, exalting and proclaiming sin as something pleasing to God, but it is not so, for these the gates of hell will open. My children, come often to visit me in this place blessed by the Father. Now I bless you in the name of the Father, the Son and the Holy Spirit, Amen ”. Queen of the Rosary ","Moje ukochane dzieci, dziękuję wam, że jesteście tu na modlitwie, och! jak bardzo łagodzisz ból mój i mojego Syna! Moi umiłowani, ale to, co robi ludzkość, to przyjmowanie, wywyższanie i głoszenie grzechu jako miłego Bogu, ale tak nie jest, dla tych bramy piekła się otworzą. Moje dzieci, często odwiedzajcie Mnie w tym miejscu, pobłogosławionym przez Ojca. Teraz błogosławię was w imię Ojca, Syna i Ducha Świętego, Amen Królowa Różańca ",October
