year,month,day,author,text,text_en,text_pl,month_string
2019,3,16,Holy Mary,"Amati figli, grazie per aver risposto alla mia chiamata nel vostro cuore. Figlioli miei, quanto conforto sento nel mio cuore nel vedervi qui nella preghiera, ecco questa è la mia Chiesa, conosco tutte le vostre afflizioni, ma vi chiedo di affidarvi al mio Gesù, affinché possa elargire tante grazie per tutti voi, oggi ci saranno delle guarigioni. Figli cari, state vicino a Dio con tutto il vostro cuore, i tempi che arriveranno saranno duri. Perché tanti dei miei figli decidono di stare dalla parte del male? Chi ha fede e guarda le leggi di Dio non deve temere nulla. Tesori miei, abbiate pietà per coloro che stanno sbagliando, amateli. Siate vicino al Vangelo e alla Parola, soprattutto amate come Dio vi ama e perdonate come Lui perdona, affinché il regno dei cieli possa aprirsi per godere di ciò che è pronto per voi. Ora, vi lascio con la mia materna benedizione, nel nome del Padre e del Figlio e dello Spirito Santo, Amen”.","Beloved children, thank you for having responded to my call in your heart. My children, how much comfort I feel in my heart in seeing you here in prayer, this is my Church, I know all your afflictions, but I ask you to entrust yourselves to my Jesus, so that I can bestow many graces for all of you, today there will be some healings. Dear children, stay close to God with all your heart, the times that will come will be hard. Why do so many of my children decide to be on the side of evil? Whoever has faith and looks at the laws of God need not fear anything. My darlings, have mercy on those who are wrong, love them. Be close to the Gospel and the Word, above all love as God loves you and forgive as He forgives, so that the kingdom of heaven can open up to enjoy what is ready for you. Now, I leave you with my motherly blessing, in the name of the Father and of the Son and of the Holy Spirit, Amen ”. ","Kochane dzieci, dziękuję wam, że odpowiedzieliście na moje wezwanie w waszych sercach. Moje dzieci, jak wielką pociechę czuję w sercu, widząc was tutaj na modlitwie, to jest mój Kościół, znam wszystkie wasze utrapienia, ale proszę was, abyście powierzyli się mojemu Jezusowi, abym mógł obdarzyć was wszystkimi wieloma łaskami, dzisiaj będzie kilka uzdrowienia. Drogie dzieci, pozostańcie blisko Boga całym sercem, czasy, które nadejdą, będą trudne. Dlaczego tak wiele moich dzieci decyduje się stanąć po stronie zła? Kto ma wiarę i patrzy na prawa Boże, nie musi się niczego obawiać. Moi drodzy, miejcie litość nad tymi, którzy się mylą, kochajcie ich. Bądźcie blisko Ewangelii i Słowa, przede wszystkim kochajcie tak, jak Bóg was kocha i przebaczajcie, jak On przebacza, aby Królestwo Niebieskie mogło się otworzyć i bycie cieszyli się tym, co jest dla was gotowe. Teraz zostawiam was z moim matczynym błogosławieństwem w imię Ojca i Syna i Ducha Świętego, Amen ",March
2019,3,19,Jesus Christ,"Figli miei, io Figlio del Padre, Vi chiedo in questo periodo di Quaresima, fate sacrifici per me. Oh! quante volte sono andato dai miei consacrati per chiedere, dove sono le anime che state portando a me, eppure non ce ne sono, da quanti figli prescelti sono passato per chiedere la stessa cosa e quante anime ho trovato che si sono avvicinati al mio cuore e in quello di mia Mamma. Ecco perché io scelgo in base ai cuori aperti che hanno il cuore di bambini e le anime rivolte al cielo e non quelli che bevono il calice della mondanità e quello dei piaceri terreni. Fratelli, io desidero che voi siate un'unica anima con la mia. Figlia e sorella mia prescelta, grazie per la tua pace, nonostante tutto, io conosco la tua sofferenza, ma so che tu mi stai offrendo tutto, ecco perché ti amo, quanto amore sento nel tuo cuore per me, ma dimmi quanto mi ami? Quanto vuoi soffrire per me? Questo è ciò che voglio. I tuoi fratelli e il tuo amato sposo sono per me luci e miele per le mie sofferenze. Vi amo tutti e vorrei tanto mostrarvi quanto siete speciali per il cielo. Vi Benedico, il vostro Caro Gesù","My children, I, the Son of the Father, I ask you in this period of Lent, make sacrifices for me. Oh! how many times have I gone to my consecrated to ask, where are the souls you are bringing to me, yet there are none, how many chosen children have I passed by to ask for the same thing and how many souls have I found that have approached my heart and in my Mom's. This is why I choose on the basis of the open hearts that have the hearts of children and the souls turned to heaven and not those who drink the cup of worldliness and that of earthly pleasures. Brothers, I want you to be one soul with mine. My chosen daughter and sister, thank you for your peace, despite everything, I know your suffering, but I know that you are offering me everything, that's why I love you, how much love I feel in your heart for me, but tell me how much do you love me? How much do you want to suffer for me? This is what I want. Your brothers and your beloved husband are lights and honey for me for my sufferings. I love you all and would love to show you how special you are to heaven. I bless you, your Dear Jesus ","Moje dzieci, Ja, Syn Ojca, proszę was w tym okresie Wielkiego Postu, czyńcie ofiary za Mnie. O! ile razy szedłem do moich poświęconych, aby zapytać, gdzie są dusze, które mi przynosisz, ale nie ma ich, ile wybranych dzieci przeszedłem, aby zapytać o to samo i ile znalazłem dusz, które zbliżyły się do mojego serca i do mojej mamy. Dlatego wybieram na podstawie otwartych serc, które mają serca dzieci i dusze zwrócone ku niebu, a nie tych, którzy piją kielich światowości i ziemskich przyjemności. Bracia, chcę, żebyście byli jedną duszą z moją. Moja wybrana córko i siostro, dziękuję Ci za pokój, mimo wszystko znam Twoje cierpienie, ale wiem, że ofiarujesz mi wszystko, dlatego Cię kocham, ile miłości czuję w Twoim sercu do mnie, ale powiedz mi, jak bardzo mnie kochasz? Ile chcesz za mnie cierpieć? To jest to czego chcę. Twoi bracia i ukochany mąż są dla mnie światłem i miodem na moje cierpienia. Kocham was wszystkich i chciałbym wam pokazać, jak wyjątkowi jesteście w Niebie. Błogosławię Cię, Twój Drogi Jezu ",March
2019,3,23,Holy Mary,"Cari figli, grazie per aver risposto alla mia chiamata nel vostro cuore. Cari figli, in questo periodo Pasquale continuate con le penitenze e sacrifici. Figli, chiedete di ricevere il dono dello Spirito Santo insieme ai sette doni, invocatelo e lui scenderà su di voi. Figli miei, i tempi che stanno arrivando saranno molto duri da affrontare, rafforzatevi nella fede e fatevi un esame di coscienza, quando andate in Chiesa ad assistere alla Santa Messa, pensate di esservi lavati la coscienza, ma non è questo il modo di essere in pace con Dio, dovete viverla intensAmente e non assisterne semplicemente, occorre confessione e comunione anche con gli altri. Fate cenacoli di preghiera. La terra tremerà ancora, il Vaticano sarà scosso, pregate per l'America che sarà martoriata dalla natura. Vi benedico, nel nome del Padre, del Figlio e dello Spirito Santo, Amen”.","Dear children, thank you for having responded to my call in your heart. Dear children, in this Easter period continue with penances and sacrifices. Children, ask to receive the gift of the Holy Spirit together with the seven gifts, invoke him and he will descend on you. My children, the times that are coming will be very hard to face, strengthen your faith and make an examination of conscience, when you go to Church to attend Holy Mass, you think you have washed your conscience, but this is not the way to be in peace with God, you must live it intensely and not simply assist in it, you need confession and communion with others too. Make cenacles of prayer. The earth will tremble again, the Vatican will be shaken, pray for America which will be tormented by nature. I bless you, in the name of the Father, of the Son and of the Holy Spirit, Amen ”. ","Drogie dzieci, dziękuję wam, że odpowiedzieliście na moje wezwanie w waszych sercach. Drogie dzieci, kontynuujcie w tym okresie wielkanocnym pokuty i ofiary. Dzieci, proście o przyjęcie daru Ducha Świętego wraz z siedmioma darami, wzywajcie Go, a zstąpi na was. Moje dzieci, będzie trudno stawić czoła nadchdzącym czasom, wzmocnijcie swoją wiarę i sprawdźcie swoje sumienie, kiedy idziecie do kościoła na Mszę św., Myślicie, że oczyciliście swoje sumienie, ale to nie jest sposób, aby być w pokoju z Bogiem, musisz go intensywnie przeżywać, a nie tylko współuczestniczyć, potrzebujesz też spowiedzi i pojednania ze wszystkimi. Czyńcie wieczerniki modlitwy. Ziemia znów się zatrzęsie, Watykan zadrży, módlcie się za Amerykę, która będzie dręczona przez naturę. Błogosławię was w imię Ojca, Syna i Ducha Świętego, Amen ",March
2019,3,26,Holy Mary,"Cari figli Benedetti, grazie per essere qui riuniti nella preghiera, affievolite i dolori di mio Figlio Gesù. Amati miei, la conversione è ciò che io chiedo continuAmente nei posti dove io sono apparsa e dove continuo ad apparire, solo così potrete entrare nel regno dei cieli. Mio Figlio vi vuole tutti salvi, peccatori e non peccatori, ricordate che Dio ama tutti allo stesso modo, attende con amore pazienza e Misericordia i suoi figli. Ora, vi lascio con la mia benedizione materna, nel nome del Padre, del Figlio e dello Spirito Santo, Amen”.","Dear blessed children, thank you for being gathered here in prayer, ease the pains of my Son Jesus. My beloved, conversion is what I continually ask for in the places where I have appeared and where I continue to appear, only in this way will you be able to enter the kingdom of skies. My Son wants you all to be saved, sinners and non-sinners, remember that God loves everyone in the same way, he awaits his children with love, patience and mercy. Now, I leave you with my maternal blessing, in the name of the Father, of the Son and of the Holy Spirit, Amen ”. ","Drogie błogosławione dzieci, dziękuję wam za zgromadzenie się tutaj na modlitwie, złagodzenie bólu mojego Syna Jezusa. Moja umiłowana, nawrócenie jest tym, o co nieustannie proszę w miejscach, w których się pojawiłam i gdzie nadal się pojawię, tylko w ten sposób będziecie mogli wejść do Królestwa Niebieskiego. Mój Syn chce, abyście wszyscy zostali zbawieni, grzesznicy i nie-grzesznicy, pamiętajcie, że Bóg kocha wszystkich w ten sam sposób, oczekuje swoich dzieci z miłością, cierpliwością i miłosierdziem. Teraz zostawiam was z moim macierzyńskim błogosławieństwem w imię Ojca, Syna i Ducha Świętego, Amen ",March
2019,3,30,Holy Mary,"Cari figli, grazie per essere qui riuniti nella preghiera, rispondendo alla mia chiamata nel vostro cuore. Amati figli, mio piccolo gregge, siate pieni di Spirito Santo, Io prego per ognuno di voi davanti a Dio, affinché il fuoco dello Spirito Santo possa infuocare la vostra anima, il vostro spirito. Amati miei, vi prego di essere forti nella fede e soprattutto nella vera e unica dottrina cristiana, in questo periodo molte cose vi saranno negate dai miei figli prediletti, ma non prostratevi innanzi ai cambiAmenti e alle Lodi moderniste, perché non vengono da Dio. Ora, vi benedico nel nome del Padre e del Figlio e dello Spirito Santo, Amen”.","Dear children, thank you for being gathered here in prayer, responding to my call in your heart. Beloved children, my little flock, be filled with the Holy Spirit, I pray for each one of you before God, so that the fire of the Holy Spirit may set your soul, your spirit on fire. My beloved, please be strong in the faith and above all in the true and unique Christian doctrine, in this period many things will be denied to you by my beloved children, but do not bow down before the modernist changes and praises, because they do not come from God. Now , I bless you in the name of the Father and of the Son and of the Holy Spirit, Amen ”. ","Drogie dzieci, dziękuję wam, że jesteście tu zgromadzeni na modlitwie, odpowiadając na moje wezwanie w waszych sercach. Umiłowane dzieci, moja mała trzódko, bądźcie napełnieni Duchem Świętym, modlę się za każdego z was przed Bogiem, aby ogień Ducha Świętego mógł rozpalić waszą duszę, waszego ducha. Moi umiłowani, proszę, bądźcie mocni w wierze, a przede wszystkim w prawdziwej i jedynej doktrynie chrześcijańskiej, w tym okresie moje ukochane dzieci odmówią wam wielu rzeczy, ale nie kłaniajcie się modernistycznym zmianom i pochwałom, ponieważ nie pochodzą one od Boga. Błogosławię was w imię Ojca i Syna i Ducha Świętego, Amen ",March
2019,4,02,Holy Mary,"Cari figli adorati, grazie per aver risposto alla mia chiamata nel vostro cuore. Amati miei, ecco la guerra è prossima, pregate tanto con il Santo Rosario nelle vostre mani, solo con la vera Fede qualcosa potrà cambiare. Figli miei, perché si continua a mortificare mio Figlio Gesù, lui è morto per redimervi dai peccati, non siate ognuno Dio di voi stessi, ricordate che le strade facilitate vengono da Satana, ma quelle di Dio sono raggiunte solo con la sofferenza. Figli, non fatevi abbagliare dalle false luci, Amate mio Figlio e la croce, solo così potrete essere degni del suo Amore e della Pace. Ora, vi benedico nel nome del Padre, del Figlio e dello Spirito Santo, Amen”.","Dear beloved children, thank you for having responded to my call in your heart. My beloved, here is the war is near, pray a lot with the Holy Rosary in your hands, only with the true Faith can something change. My children, because my Son Jesus continues to be mortified, he died to redeem you from sins, do not be each God of yourselves, remember that the facilitated paths come from Satan, but those of God are reached only with suffering. Children, do not be dazzled by the false lights, Love my Son and the cross, only in this way can you be worthy of his Love and of his Peace. Now, I bless you in the name of the Father, the Son and the Holy Spirit, Amen ”. ","Drogie dzieci, dziękuję, że odpowiedzieliście na moje wezwanie w waszych sercach. Moi umiłowani, wojna jest blisko, módlcie się dużo z różańcem w dłoniach, tylko prawdziwą wiarą możecie coś zmienić.. Moje dzieci, ponieważ mój Syn Jezus nadal jest umartwiony, umarł, aby odkupić was od grzechów, nie bądźcie Bogiem sami dla siebie, pamiętajcie, że ułatwione ścieżki pochodzą od szatana, ale do tych Bożych dochodzi się tylko przez cierpienie. Dzieci, nie dajcie się oślepiać fałszywymi światłami, kochajcie mojego Syna i krzyż, tylko w ten sposób możecie być godni Jego Miłości i Pokoju. Teraz błogosławię was w imię Ojca, Syna i Ducha Świętego, Amen ",April
2019,4,03,Holy Mary,"Cari figli, grazie per essere qui nella preghiera e grazie per aver risposto alla mia chiamata nel vostro cuore. Amati figli, sono qui ancora oggi per ricordarvi di aprire i vostri cuori e iniziare la vera conversione. Figli, date tutte le vostre tribolazioni a me ed io vi solleverò, invocate mio Figlio e lui vi sarà vicino per proteggervi soprattutto nei momenti di tribolazione, vi chiedo di amarmi e di essere uniti per i giorni di difficoltà che arriveranno, Dio vuole solo amore, lasciatevi coccolare da lui come bambini. Figli, fate cenacoli di preghiera nelle vostre case, soprattutto insegnate ai vostri figli l'amore per il Padre vostro e l'amore del Padre per loro. Amati miei, non abbiate paura, finché io sarò con voi non dovrete temere nulla, rafforzatevi nella fede, solo cosi non andrete incontro ai pericoli. Ora, vi lascio con la mia benedizione materna e portate la pace nelle vostre case, nel nome del Padre, del Figlio e dello Spirito Santo, Amen”.","Dear children, thank you for being here in prayer and thank you for having responded to my call in your heart. Beloved children, I am still here today to remind you to open your hearts and begin true conversion. Children, give all your tribulations to me and I will lift you up, invoke my Son and he will be close to you to protect you especially in times of tribulation, I ask you to love me and to be united for the days of difficulty that will come, God only wants love , let yourself be pampered by him like children. Children, conduct cenacles of prayer in your homes, above all teach your children the love for your Father and the Father's love for them. My beloved, do not be afraid, as long as I am with you you will not have to fear anything, strengthen yourself in the faith, only in this way you will not encounter dangers. Now, I leave you with my maternal blessing and bring peace to your homes, in the name of the Father, the Son and the Holy Spirit, Amen ”. ","Drogie dzieci, dziękuję wam, że jesteście tu na modlitwie i dziękuję, że odpowiedzieliście na moje wezwanie w waszych sercach. Umiłowane dzieci, wciąż tu jestem, aby przypomnieć wam o otwarciu serc i rozpoczęciu prawdziwego nawrócenia. Dzieci, oddajcie mi wszystkie swoje udręki, a ja was podniosę, wzywajcie mojego Syna, a on będzie blisko was, aby was chronić, szczególnie w czasach ucisku, proszę was, abyście mnie kochali i byli zjednoczeni na dni trudności, które nadejdą, Bóg tylko chce miłości , pozwólcie mu się rozpieszczać jak dzieci. Dzieci, prowadźcie wieczerniki modlitwy w waszych domach, przede wszystkim uczcie wasze dzieci miłości do Ojca i miłości Ojca do nich. Moi umiłowani, nie lękajcie się, dopóki jestem z wami, nie będziecie musieli się niczego bać, umacniajcie się w wierze, tylko w ten sposób nie napotkacie niebezpieczeństw. Teraz zostawiam was z moim macierzyńskim błogosławieństwem i niosę pokój w waszych domach, w imię Ojca, Syna i Ducha Świętego, Amen ",April
2019,4,06,Holy Mary,"Amati miei, sono L’ Immacolata Concezione, grazie per aver risposto alla mia chiamata nel vostro cuore, siete qui nella preghiera in questo luogo Benedetto, Io ascolto le vostre suppliche e le vostre richieste, perché so quanto è contrito il vostro cuore, pregate sempre il Santo Rosario se volete allontanare la guerra che è sempre più imminente. La vostra fede vi darà pace e gioia, pregate per i giovani che si stanno facendo trascinare da Satana verso le tenebre. Oggi concederò alcune Grazie. Pregate, pregate, pregate con amore ed io invierò la luce nei vostri cuori aprendoli alla Grazia. Ora, vi benedico nel nome del Padre e del Figlio e dello Spirito Santo, Amen”.","My beloved, I am The Immaculate Conception, thank you for having answered my call in your heart, you are here in prayer in this blessed place, I listen to your pleas and your requests, because I know how contrite your heart is, always pray the Holy Rosary if you want to avert the war that is ever more imminent. Your faith will give you peace and joy, pray for the young people who are being dragged by Satan into the darkness. Today I will grant some Graces. Pray, pray, pray with love and I will send the light into your hearts, opening them to Grace. Now, I bless you in the name of the Father and of the Son and of the Holy Spirit, Amen ”. ","Moi umiłowani, jestem Niepokalanyn Poczęciem, dziękuję, że odpowiedzieliście na moje wezwanie w swoim sercu, jesteście tu na modlitwie w tym błogosławionym miejscu, słucham waszych błagań i próśb, ponieważ wiem, jak skruszone jest wasze serce, zawsze odmawiajcie Różaniec Święty, jeśli chcecie uniknąć wojny, która jest coraz bardziej nieuchronna. Wasza wiara da wam pokój i radość, módlcie się za młodych ludzi, których szatan ciągnie w ciemność. Dziś udzielę łask. Módlcie się, módlcie się, módlcie się z miłością, a poślę światło do waszych serc, otwierając je na łaskę. Teraz błogosławię was w imię Ojca i Syna i Ducha Świętego, Amen ",April
2019,4,09,Holy Mary,"Cari figli, grazie per aver risposto alla mia chiamata nel vostro cuore. Figli, siate pronti perché il segno eclatante che attendete sta per arrivare. Amati figli, siate pronti per quando il fuoco dello Spirito Santo invaderà i vostri cuori, guai per chi non lo sarà, perché verrà colto da una grande sofferenza. Cari figli, adesso siamo nel tempo in cui i cieli si apriranno e udirete le trombe degli Angeli suonare, la purificazione sarà più forte di prima. Amati figli miei, presto verrà tolta l'Eucarestia dalla Chiesa. Pregate, pregate, pregate per i governanti dell'America, affinché non prendano decisioni sbagliate. Ora vi benedico nel nome del Padre, del Figlio e dello Spirito Santo, Amen”.","Dear children, thank you for having responded to my call in your heart. Children, be ready because the striking sign you await is about to arrive. Beloved children, be ready for when the fire of the Holy Spirit invades your hearts, woe to those who do not, because they will be seized by a great suffering. Dear children, now we are in the time when the heavens will open and you will hear the trumpets of the Angels sound, the purification will be stronger than before. My beloved children, the Eucharist will soon be removed from the Church. Pray, pray, pray for the rulers of America, that they don't make bad decisions. Now I bless you in the name of the Father, the Son and the Holy Spirit, Amen ”. ","Drogie dzieci, dziękuję wam, że odpowiedzieliście na moje wezwanie w waszych sercach. Dzieci, bądźcie gotowi, ponieważ uderzający znak, na który czekacie, wkrótce nadejdzie. Umiłowane dzieci, bądźcie gotowi na to, że ogień Ducha Świętego wtargnie w wasze serca, biada tym, którzy tego nie robią, ponieważ zostaną pochwyceni przez wielkie cierpienie. Drogie dzieci, teraz jesteśmy w czasie, kiedy niebiosa się otworzą i usłyszysz dźwięk trąb aniołów, oczyszczenie będzie silniejsze niż wcześniej. Moje umiłowane dzieci, Eucharystia zostanie wkrótce usunięta z Kościoła. Módlcie się, módlcie się, módlcie się za władców Ameryki, aby nie podejmowali złych decyzji. Teraz błogosławię was w imię Ojca, Syna i Ducha Świętego, Amen ",April
2019,4,13,Holy Mary,"Amati figli, grazie per aver risposto alla mia chiamata nel vostro cuore. Figli miei, quanti dolori ascolto, io sono qui per condurvi verso la luce del Signore. Cari figlioli, io sono arrivata a toccare la terra, ma pochi ascoltano i miei messaggi, sappiate che presto la terra tremerà, ma voi state nella gioia e nell'amore di Dio, non perdetevi, la vostra fonte dovrà essere il Vangelo. Amati figli, in questa settimana di Pasqua, amate la Croce e ringraziate il Signore, non sempre potrete capire tutto ciò che sono i progetti di Dio e spesso è umanAmente incomprensibile, solo il cielo e la preghiera potrà rispondere ai vostri quesiti se avrete aperto il vostro cuore. Non cambiate le preghiere e non cambiate nulla dei dogmi della fede perché sarebbe una bestemmia, satana è astuto, prende le anime senza che ve ne accorgiate. Io vi amo, sono vostra Madre, vi proteggo e vi metto tutti sotto il mio Manto. Ora, vi lascio con la mia benedizione materna, nel nome del Padre, del Figlio dello Spirito Santo, Amen”.","Beloved children, thank you for having responded to my call in your heart. My children, how many pains I hear, I am here to lead you towards the light of the Lord. Dear children, I have come to touch the earth, but few listen to my messages, know that soon the earth will tremble, but you are in the joy and love of God, do not get lost, your source must be the Gospel. Beloved children, in this Easter week, love the Cross and thank the Lord, you will not always be able to understand all that God's plans are and it is often humanly incomprehensible, only heaven and prayer will be able to answer your questions if you have opened the your heart. Do not change the prayers and do not change anything of the dogmas of the faith because it would be a blasphemy, Satan is cunning, he takes souls without you noticing. I love you, I am your Mother, I protect you and I place you all under my Mantle. Now, I leave you with my maternal blessing, in the name of the Father, of the Son of the Holy Spirit, Amen ”. ","Kochane dzieci, dziękuję, że odpowiedzieliście na moje wezwanie w waszych sercach. Moje dzieci, ile boleści słyszę, jestem tutaj, aby was prowadzić do światła Pana. Drogie dzieci, przyszłam dotknąć ziemi, ale niewielu słucha moich orędzi, wie, że wkrótce ziemia zadrży, ale jesteście w radości i miłości Boga, nie zgubcie się, waszym źródłam musi być Ewangelia. Umiłowane dzieci, w tym tygodniu wielkanocnym kochajcie krzyż i dziękujcie Panu, nie zawsze będziecie w stanie zrozumieć wszystkich planów Bożych i często jest to po ludzku niezrozumiałe, tylko Niebo i modlitwa będą w stanie odpowiedzieć na wasze pytania, jeśli otworzyliście Twoje serce. Nie zmieniajcie modlitw i nie zmieniajcie niczego z dogmatów wiary, bo byłoby to bluźnierstwem, szatan jest przebiegły, bierze dusze, nie zauważając was. Kocham cię, jestem twoją Matką, chronię cię i umieszczam wszystkich pod swoim Płaszczem. Teraz zostawiam was z moim macierzyńskim błogosławieństwem, w imię Ojca, Syna Ducha Świętego, Amen ",April
