year,month,day,author,text,text_en,text_pl,month_string
2019,6,25,Holy Mary,"Cari figli, grazie per aver risposto alla mia chiamata nel vostro cuore. Figli miei, vi chiedo la conversione urgente, non c'è più tempo, dopo tutti i segni che vengono dal cielo perché ancora non credete! Ponetevi delle domande, convertitevi, perché il peggio dovrà ancora arrivare e voi non siete pronti. Amati figli miei, quando l'Eucaristia non ci sarà più, la chiesa non sarà più chiamata la casa di Dio, ma semplice luogo di preghiera, non siate infedeli, combattete per la Verità. Figli miei, ricordate che Dio è Amore, Vita e Verità ed è l'unica vostra certezza, non siate legati alle cose materiali, perché presto spariranno. Voi figli, capirete che l'unica certezza è in Dio e non quello che costruite. La terra continuerà a tremare. Pregate per il Papa. Ora, vi lascio con la mia Santa Benedizione nel nome del Padre, del Figlio e dello Spirito Santo, Amen”.","Dear children, thank you for having responded to my call in your heart. My children, I ask you for an urgent conversion, there is no more time, after all the signs that come from heaven because you still do not believe! Ask yourself some questions, be converted, because the worst is yet to come and you are not ready. My beloved children, when the Eucharist will no longer exist, the church will no longer be called the house of God, but a simple place of prayer, do not be unfaithful, fight for the Truth. My children, remember that God is Love, Life and Truth and it is your only certainty, do not be tied to material things, because they will soon disappear. You children, you will understand that the only certainty is in God and not what you build. The earth will continue to shake. Pray for the Pope. Now, I leave you with my Holy Blessing in the name of the Father, the Son and the Holy Spirit, Amen ”. ","Drogie dzieci, dziękuję wam, że odpowiedzieliście na moje wezwanie w waszych sercach. Moje dzieci, proszę was o pilne nawrócenie, nie ma już czasu, po tych wszystkich znakach, które pochodzą z Nieba, ponieważ wciąż nie wierzycie! Zadaj sobie kilka pytań, nawróć się, bo najgorsze dopiero nadejdzie, a nie jesteś gotowy. Moje umiłowane dzieci, kiedy Eucharystia już nie będzie istnieć, kościół nie będzie już nazywany domem Bożym, ale prostym miejscem modlitwy, nie bądźcie niewierni, walczcie o Prawdę. Moje dzieci, pamiętajcie, że Bóg jest Miłością, Życiem i Prawdą i to jest wasza jedyna pewność, nie przywiązujcie się do rzeczy materialnych, bo one wkrótce znikną. Wy dzieci, zrozumiecie, że jedyna pewność jest w Bogu, a nie w tym, co budujecie. Ziemia będzie się nadal trząść. Módlcie się za Papieża, a teraz zostawiam was z moim Świętym Błogosławieństwem w imię Ojca, Syna i Ducha Świętego, Amen ",June
2019,6,29,Holy Mary,"Cari figli, grazie per essere riuniti qui nella preghiera e grazie per tutto l’amore che sento nei vostri cuori. Amati figli miei, non abbiate paura, io sono qui con voi e lo sarò sempre. Offrite a mio figlio le vostre angosce e lui le trasformerà in gioia, i vostri cattivi pensieri e lui li trasformerà in pensieri d’amore. Figli, presto avrete una notizia eclatante e una grande falsità provenire dalla sede di Pietro. Pregate e perdonate. Ora, vi benedico nel nome del Padre, del Figlio e dello Spirito Santo, Amen”.","Dear children, thank you for being gathered here in prayer and thank you for all the love I feel in your hearts. My beloved children, do not be afraid, I am here with you and I always will be. Offer to my son your anxieties and he will transform them into joy, your bad thoughts and he will transform them into thoughts of love. Children, soon you will have sensational news and a great falsehood coming from the See of Peter. Pray and forgive. Now, I bless you in the name of the Father, the Son and the Holy Spirit, Amen ”. ","Drogie dzieci, dziękuję wam, że jesteście tu zgromadzeni na modlitwie i dziękuję za całą miłość, którą czuję w waszych sercach. Moje ukochane dzieci, nie bójcie się, jestem tu z wami i zawsze będę. Ofiaruj mojemu Synowi swoje troski, a on przekształci je w radość, ofiaruj swoje złe myśli, a on przekształci je w myśli miłości. Dzieci, wkrótce będziecie mieli sensacyjne wieści i wielkie kłamstwo pochodzące ze Stolicy Piotrowej. Módlcie się i wybaczajcie. Teraz błogosławię was w imię Ojca, Syna i Ducha Świętego, Amen ",June
2019,7,02,Holy Mary,"Amati figli, grazie per essere qui riuniti nella preghiera e grazie per aver risposto alla mia chiamata nei vostri cuori. Figli, perché ancora non vi convertite completAmente! Devi dire, soprattutto ai miei figli prediletti (sacerdoti), di insegnare la parola di Dio e parlare del Vangelo, non voglio vedere i miei figli precipitare nell’abisso. Ora, figli, il mio Gesù è misericordioso, ma non attendete oltre, il tempo è arrivato. La terra continuerà a tremare sempre di più. Ora, vi lascio la mia pace e portatela nelle vostre case, vi benedico nel nome del Padre, del Figlio e dello Spirito Santo, Amen”. Figli miei, domani sarò ancora con voi","Beloved children, thank you for being gathered here in prayer and thank you for having responded to my call in your hearts. Children, because you are not yet completely converted! You have to tell, especially my beloved children (priests), to teach the word of God and speak the Gospel, I don't want to see my children plunged into the abyss. Now, children, my Jesus is merciful, but do not wait any longer, the time has arrived. The earth will continue to shake more and more. Now, I leave you my peace and bring it into your homes, I bless you in the name of the Father, of the Son and of the Holy Spirit, Amen ”. My children, tomorrow I will still be with you ","Umiłowane dzieci, dziękuję wam, że zgromadziliście się tutaj na modlitwie i dziękuję, że odpowiedzieliście na moje wezwanie w waszych sercach. Dzieci, ponieważ nie jesteście jeszcze całkowicie nawróceni! Musicie powiedzieć, zwłaszcza moim ukochanym dzieciom (kapłanom), aby nauczać słowa Bożego i głosić Ewangelię, że nie chcę widzieć moich dzieci pogrążonych w otchłani. Teraz, dzieci, mój Jezus jest miłosierny, ale nie czekajcie dłużej, nadszedł czas. Ziemia będzie się coraz bardziej trząść. Teraz zostawiam wam mój pokój i wnoszę go do waszych domów, błogosławię was w imię Ojca, Syna i Ducha Świętego, Amen Moje dzieci, jutro nadal będę z wami ",July
2019,7,03,Holy Mary,"Figli amati, grazie per aver risposto alla mia chiamata nel vostro cuore. Figli miei, vi chiedo la pace, la pace tra gli uomini, la pace nelle famiglie, la pace tra le nazioni e i potenti del mondo. Figli miei, la pace tra gli uomini, deve essere al di là di ogni nazione, di ogni religione, di ogni razza. Pace significa anche rispetto per i diversi Credo, ma voi, amatevi come fratelli nell’amore di un unico Dio, Gesù fatto uomo e morto per voi sulla croce per la vostra salvezza e per i vostri peccati, Il quale ha lasciato la Sua Parola che è una sola, per tutti e per sempre. Tutte le religioni non possono stare in un'unica preghiera nella Casa di Dio, la mia Chiesa si salverà grazie alla vostra Fede. Ora vi benedico, nel nome del Padre, del Figlio e dello Spirito Santo, Amen”. Oggi, tante saranno le grazie che scenderanno su di voi.","Beloved children, thank you for having responded to my call in your heart. My children, I ask you for peace, peace between men, peace in families, peace between nations and the powerful of the world. My children, peace between men must be beyond any nation, any religion, any race. Peace also means respect for the different Creeds, but you, love each other as brothers in the love of one God, Jesus made man and died for you on the cross for your salvation and for your sins, who left His Word that it is one, for all and forever. All religions cannot be in one prayer in the House of God, my Church will be saved thanks to your Faith. Now I bless you, in the name of the Father, of the Son and of the Holy Spirit, Amen ”. Today, there will be many graces that will descend on you. ","Kochane dzieci, dziękuję wam, że odpowiedzieliście na moje wezwanie w waszych sercach. Moje dzieci, proszę was o pokój, pokój między ludźmi, pokój w rodzinach, pokój między narodami i mocarzami świata. Moje dzieci, pokój między ludźmi musi być poza jakimkolwiek narodem, jakąkolwiek religią, jakąkolwiek rasą. Pokój oznacza także szacunek dla różnych wyznań wiary, ale wy kochacie się jak bracia w miłości jednego Boga, Jezusa, który stał się człowiekiem i umarł za was na krzyżu za wasze zbawienie i za wasze grzechy, który zostawił swoje Słowo, które jest jedno, wieczne i powrzechne. Wszystkie religie nie mogą być w jednej modlitwie w Domu Bożym, mój Kościół zostanie zbawiony dzięki waszej wierze. Teraz was błogosławię w imię Ojca, Syna i Ducha Świętego, Amen Dzisiaj spłynie na was wiele łask. ",July
2019,7,09,Holy Mary,"Cari figli amati, grazie per aver risposto alla mia chiamata nel vostro cuore. Figli, quante sono le brutture di questo mondo e tutto ciò causa dolore al mio cuore e a quello di mio Figlio. Bambini miei, pregate affinchè mio Figlio Gesù possa anticipare il tempo del suo arrivo. Cose grandi fa l’onnipotente per coloro che hanno fede. Pregate per il mondo, in particolare per l’America. Ora vi benedico, nel nome del Padre, del Figlio e dello Spirito Santo, Amen”.","Dear beloved children, thank you for having responded to my call in your heart. Children, how many are the ugliness of this world and all this causes pain to my heart and to that of my Son. My children, pray that my Son Jesus may anticipate the time of his arrival. The almighty does great things for those who have faith. Pray for the world, especially for America. Now I bless you, in the name of the Father, of the Son and of the Holy Spirit, Amen ”. ","Drogie dzieci, dziękuję, że odpowiedzieliście na moje wezwanie w waszych sercach. Dzieci, jak wiele jest brzydoty tego świata i wszystko to powoduje ból w moim sercu i w sercu mojego Syna. Moje dzieci, módlcie się, aby mój Syn Jezus przyspieszył czas swojego przyjścia. Wszechmocny czyni wielkie rzeczy dla tych, którzy wierzą. Módlcie się za świat, zwłaszcza za Amerykę. Teraz was błogosławię w imię Ojca, Syna i Ducha Świętego, Amen ",July
2019,7,13,Holy Mary,"Cari figli, grazie per aver risposto alla mia chiamata nel vostro cuore. Figli amati, tutto ciò che sta avvenendo, era stato predetto, molti chiedono i segni prima della venuta di Gesù, ma dopo tutto ciò che accade, i terremoti, le acque che scendono dal cielo con potenza e che entrano nelle città facendo da padrona, voi ancora nonostante tutto, non capite. Figli, non attendete, non avete più tempo perché troppo grande è il vostro peccato. Pregate figli, non attendete la notte gelida, pregate per l'Italia che rifiuta la grazia e pregate per l'America, che ha fatto entrare Satana nella loro Nazione, convertitevi. Ora vi benedico, nel nome del Padre, del Figlio e dello Spirito Santo, Amen”.","Dear children, thank you for having responded to my call in your heart. Beloved children, everything that is happening was foretold, many ask for the signs before the coming of Jesus, but after everything that happens, the earthquakes, the waters that come down from heaven with power and that enter the cities as mistress, you still in spite of everything, you don't understand. Children, do not wait, you have no more time because your sin is too great. Pray children, do not wait for the cold night, pray for Italy which refuses grace and pray for America, which has allowed Satan to enter their Nation, be converted. Now I bless you, in the name of the Father, of the Son and of the Holy Spirit, Amen ”. ","Drogie dzieci, dziękuję wam, że odpowiedzieliście na moje wezwanie w waszych sercach. Umiłowane dzieci, wszystko, co się dzieje, zostało przepowiedziane, wielu prosi o znaki przed przyjściem Jezusa, ale po wszystkim, co się dzieje, po trzęsieniach ziemi, po wodach, które z mocą zstępują z nieba i które wchodzą do miast jako pani, nadal mimo wszystko nie rozumiesz. Dzieci, nie czekajcie, nie macie więcej czasu, ponieważ wasz grzech jest zbyt wielki. Módlcie się dzieci, nie czekajcie na zimną noc, módlcie się za Włochy, które odmawiają łaski i módlcie się za Amerykę, która pozwoliła szatanowi wejść do ich narodu, nawrócić się. Teraz was błogosławię w imię Ojca, Syna i Ducha Świętego, Amen ",July
2019,7,16,Holy Mary,"Amati figli miei, grazie per aver risposto alla mia chiamata, che la pace scenda nei vostri cuori. Figli miei, pregate per la Chiesa, pregate per i sacerdoti, per i vescovi e cardinali affinchè possano aprire i loro cuori alla grazia senza banalizzare i sacrAmenti, soprattutto, l’Eucarestia. Figli, vi prego, prendete le mie mani affinchè possa portarvi a mio Figlio Gesù. Figli amati, vi chiedo di fare cenacoli nelle case, nelle famiglie affinchè possiate essere più protetti, il rosario è la preghiera potente contro il male, non dimenticatelo mai. Ora, vi lascio con la mia Santa benedizione, nel nome del Padre, del Figlio e dello Spirito Santo, Amen”.","My beloved children, thank you for having responded to my call, may peace descend into your hearts. My children, pray for the Church, pray for priests, bishops and cardinals so that they can open their hearts to grace without trivializing the sacraments, especially the Eucharist. Children, please, take my hands so that I can bring you to my Son Jesus. Beloved children, I ask you to make cenacles in homes, in families so that you can be more protected, the rosary is the powerful prayer against evil, never forget it. Now, I leave you with my Holy Blessing, in the name of the Father, the Son and the Holy Spirit, Amen ”. ","Moje ukochane dzieci, dziękuję wam, że odpowiedzieliście na moje wezwanie, niech pokój zapanuje w waszych sercach. Moje dzieci, módlcie się za Kościół, módlcie się za kapłanów, biskupów i kardynałów, aby mogli otworzyć swoje serca na łaskę bez bagatelizowania sakramentów, zwłaszcza Eucharystii. Dzieci, weźcie mnie za ręce, abym mógł przyprowadzić was do mojego Syna Jezusa. Umiłowane dzieci, proszę was o odprawianie wieczerników w domach, rodzinach, abyście byli bardziej chronieni, różaniec jest potężną modlitwą przeciwko złu, nigdy o tym nie zapominajcie. Teraz zostawiam was z moim Świętym Błogosławieństwem, w imię Ojca, Syna i Ducha Świętego, Amen ",July
2019,7,20,Jesus Christ,"Cari fratelli, grazie per essere qui riuniti nella preghiera. Fratelli miei, quante sono le grazie che chiedete, ma voi vi siete chiesti quanto è grande la vostra fede? Spero di abbracciarvi presto e finalmente vi potrò saziare delle delizie che ho pronte per voi. Fratelli amati, amate Dio in tutta la Sua pienezza, convertitevi, il tempo è finito, la giustizia è già su di voi, vedrete palle di fuoco venire dal cielo, la terra non smetterà di tremare, malattie vecchie e seppellite torneranno e malattie nuove si affacceranno. Pregate per miei apostoli e per coloro che hanno sposato Dio, la Chiesa di Pietro presto verrà abitata dalla rivoluzione, pregate per i potenti del mondo, affinchè regni la pace. Fratelli miei, perché vi girate dall’altra parte, facendo finta che il mondo sia sempre stato così, non volete cambiare atteggiAmento davanti all’immenso amore di Dio, non volete capire, che tutto ciò che fa parte di questo mondo presto non esisterà più, perché invaso da satana, e voi cosa fate? Invece di seguire la strada dei giusti, prendete quella più comoda, con le cose più semplici che è quella del demonio per poi morire in eterno. Battetevi per la vita eterna e non cadete nelle fiamme infernali che come lunghe lingue di fuoco, cercano le vostre anime. Fratelli, tutto questo non lo dico per spaventarvi, ma solo per scuotere le vostre coscienze e farvi capire cosa vi aspetta, prendete la strada di Dio, si, forse più difficile, ma sicura e con il Mio aiuto e quello di mia Madre, sarete al sicuro e tutto sarà più semplice. Ora vi do, la mia santa benedizione nel nome del Padre, nel mio Nome e dello Spirito Santo, Amen”.","Dear brothers, thank you for being gathered here in prayer. My brothers, how many graces are you asking for, but have you wondered how great is your faith? I hope to embrace you soon and finally I will be able to satiate you with the delights I have ready for you. Beloved brothers, love God in all His fullness, be converted, time is over, justice is already upon you, you will see fireballs coming from heaven, the earth will not stop shaking, old and buried diseases will return and new diseases will return. will look out. Pray for my apostles and for those who have married God, the Church of Peter will soon be inhabited by the revolution, pray for the powerful of the world, for peace to reign. My brothers, because you turn away, pretending that the world has always been like this, you do not want to change your attitude in front of the immense love of God, you do not want to understand, that everything that is part of this world will soon no longer exist. , because invaded by satan, and what are you doing? Instead of following the path of the righteous, take the more comfortable one, with the simplest things which is that of the devil and then die forever. Strive for eternal life and do not fall into the infernal flames which, like long tongues of fire, seek your souls. Brothers, I am not saying all this to scare you, but only to shake your consciences and make you understand what awaits you, take the path of God, yes, perhaps more difficult, but sure and with My help and that of my Mother, you will be safe and everything will be easier. Now I give you, my holy blessing in the name of the Father, in my Name and in the Holy Spirit, Amen ”. ","Drodzy bracia, dziękuję, że jesteście tu zgromadzeni na modlitwie. Moi bracia, o ile łask prosicie, ale czy zastanawialiście się, jak wielka jest wasza wiara? Mam nadzieję, że wkrótce cię przytulę i wreszcie będę mógł cię nasycić dobrami, które dla ciebie przygotowałem. Umiłowani bracia, miłujcie Boga w całej Jego pełni, nawróćcie się, czas się skończył, sprawiedliwość już nad wami, ujrzycie kule ognia z nieba, ziemia nie przestanie się trząść, powrócą stare i pogrzebane choroby i przyjdą nowe choroby. będzie wyglądać. Módlcie się za moich apostołów i za tych, którzy poślubili Boga, Kościół Piotra wkrótce zostanie zamieszkany przez rewolucję, módlcie się za możnych tego świata, aby zapanował pokój. Moi bracia, ponieważ odwracacie się, udając, że świat zawsze taki był, nie chcecie zmieniać swojego nastawienia przed ogromną miłością Boga, nie chcecie zrozumieć, że wszystko, co jest częścią tego świata, wkrótce przestanie istnieć , ponieważ został on zaatakowany przez szatana, a ty co robisz? Zamiast podążać ścieżką prawych, wybierasz wygodniejszą, z najprostszymi rzeczami, którą jest diabeł, a potem umrzesz na zawsze. Starajcie się o życie wieczne i nie wpadajcie w piekielne płomienie, które jak długie języki ognia szukają waszych dusz. Bracia, nie mówię tego wszystkiego po to, aby was przestraszyć, ale tylko po to, aby wstrząsnąć waszymi sumieniami i sprawić, byście zrozumieli, co was czeka, idźcie ścieżką Boga, tak, może trudniejszą, ale pewną i z pomocą Moją i mojej Matki będziecie bezpieczne i wszystko będzie łatwiejsze. Teraz daję wam, moje święte błogosławieństwo, w imię Ojca, w moje Imię i w Ducha Świętego, Amen ",July
2019,7,23,Holy Mary,"Amati figli, grazie per aver risposto alla mia chiamata nel vostro cuore. Amati miei, gioite, perché presto mio Figlio Gesù sarà tra voi per rinnovare la terra. La chiesa verrà rinnovata solo quando, di questa vecchia chiesa, insieme a coloro che adorano Satana, non rimarrà che la polvere. Pregate figli, pregate affinché i cuori si aprano all'amore di Dio, perché non riuscite ad amare così come Lui vi ama di un amore immenso? Eppure, vi ha creati e coccolati! Pregate per il Papa, che presto verrà attaccato. Figli cari, presto la luce arriverà nel cielo e capirete che Dio è qui per voi e allora chiederete perdono con il cuore e Lui nella sua infinita Misericordia vi accoglierà, ma non attendete fino ad allora. Ora vi benedico nel nome del Padre e del Figlio e dello Spirito Santo, Amen”.","Beloved children, thank you for having responded to my call in your heart. My beloved, rejoice, because soon my Son Jesus will be among you to renew the earth. The church will be renewed only when, of this old church, together with those who worship Satan, there will be nothing but dust. Pray children, pray so that hearts open to the love of God, why are you not able to love as he loves you with an immense love? Yet, he created and pampered you! Pray for the Pope, who will soon be attacked. Dear children, soon the light will arrive in heaven and you will understand that God is here for you and then you will ask for forgiveness with your heart and He will welcome you in his infinite Mercy, but do not wait until then. Now I bless you in the name of the Father and of the Son and of the Holy Spirit, Amen ”. ","Kochane dzieci, dziękuję wam, że odpowiedzieliście na moje wezwanie w waszych sercach. Moi umiłowani, radujcie się, ponieważ wkrótce mój Syn Jezus będzie wśród was, aby odnowić ziemię. Kościół zostanie odnowiony tylko wtedy, gdy w tym starym kościele, po tych, którzy czczą szatana, nie będzie nic prócz kurzu. Módlcie się dzieci, módlcie się, aby serca były otwarte na miłość Boga, dlaczego nie możecie kochać tak, jak On kocha was ogromną miłością? A jednak stworzył cię i rozpieszczał! Módlcie się za Papieża, który wkrótce zostanie zaatakowany. Drogie dzieci, wkrótce światło zjawi się w niebie i zrozumiecie, że Bóg jest tutaj dla was i wtedy sercem proście o przebaczenie, a On w swoim nieskończonym Miłosierdziu was przywita, ale nie czekajcie do tego czasu. Teraz błogosławię was w imię Ojca i Syna i Ducha Świętego, Amen ",July
2019,7,25,Holy Mary,"Figli amati, grazie per essere qui in questa casa benedetta, Io ho voluto che ancora oggi ci fosse questo Rosario affinchè ancora una volta, possiate vedere il miracolo delle mie lacrime. Figli, sento tanto amore, ma nello stesso tempo avete il cuore contrito. Figli cari, quante malattie e quante cose accadranno su questa terra, tutto questo è stato scritto e cosi sarà, ma voi non temete, avrete la nostra protezione, non abbiate paura. Amate mio Figlio Gesù e pregate, vi supplico pregate tanto per la Pace. Ora, vi benedico nel nome del Padre e del Figlio e dello Spirito Santo, Amen”. La madonna ha imposto le mani su ognuno di noi elargendo la sua santa benedizione.","Beloved children, thank you for being here in this blessed house, I wanted this Rosary to still be there today so that once again, you can see the miracle of my tears. Children, I feel so much love, but at the same time you have a contrite heart. Dear children, how many diseases and how many things will happen on this earth, all this has been written and so it will be, but you do not fear, you will have our protection, do not be afraid. Love my Son Jesus and pray, I beg you, pray a lot for Peace. Now, I bless you in the name of the Father and of the Son and of the Holy Spirit, Amen ”. The Madonna laid her hands on each of us by bestowing her holy blessing. ","Umiłowane dzieci, dziękuję wam, że jesteście tutaj w tym błogosławionym domu, chciałem, aby ten różaniec nadal tam był dzisiaj, abyście znowu mogli zobaczyć cud moich łez. Dzieci, czuję tak wielką miłość, ale jednocześnie macie skruszone serce. Drogie dzieci, ile chorób i ile rzeczy wydarzy się na tej ziemi, wszystko to zostało napisane i tak będzie, ale nie lękajcie się, będziecie mieć naszą ochronę, nie bójcie się. Kochajcie mojego Syna Jezusa i módlcie się, błagam was, módlcie się dużo o pokój. Teraz błogosławię was w imię Ojca i Syna i Ducha Świętego, Amen Madonna położyła ręce na każdym z nas, udzielając swojego świętego błogosławieństwa. ",July
